"[37] This is a cruel exchange of thrusts: In the art, a more deceptive thrust than this cannot be made. You attacked me with the point and I have given you this; And I can make more secure it by voiding out of the way. This play is named “The Exchange of Points”,[289] and it is done like this: when your opponent thrusts at you, quickly advance your front foot off the line, and with the other foot step to the side,[290] also moving off the line, crossing his sword with your hands[291] low and with your point high into his face, or chest, as you see drawn here.","[14v-c] Questo zogo che se chiama scambiare de punta, e se fa per tal modo zoe quando te tra una punta subito acrese lo tuo pe denanci fora de strada a cum l'altro pe passa ala traversa anchora fora de strada, atraversando la sua spada cum gli toii brazi bassi, E cum la punta dela spada erta in lo volto o in lo petto come e aqui dipento.","[26v-a] ¶ Questo zogho si chiama scambiar de punta e se fa per tal modo zoe. Quando uno te tra una punta. subito acresse lo tuo pe ch'e denançi fora de strada, e cum l'altro pe passa ala traversa anchora fora di strada, traversando la sua spada cum cum[292] gli toi brazzi bassi, e cum la punta dela tua spada erta in lo volto o in lo petto come depento."
"[38] Because of your hilt, which I hold in my hand, I will make you bleed with my point in your face. This play comes from the exchange of points that came before me. If you make the thrust, and your opponent fails to immediately position his point either into your face or into your chest, perhaps because you are in armor, then you should quickly pass forward with your left foot, and seize his sword as shown here. Then strike him hard with your sword, since you have his sword gripped and he cannot escape.","[14v-d] De questo scambiar de punta che m'e denanci essi aquesto zogo. Che subito lo che lo scolar che m'e denanci non metesse la punta in lo volto delo zugadore ch'ello la falasse ch'ello non la metesse in lo volto ne in lo petto, o perche fosse lo zugadore armato. Subito debia lo scolar cum lo pe stancho innanci passar. E per questo modo lo debia piglare, e la sua spada metero[!] a bon ferire, po che lo zugadore e presa sua[294] spada non po fuzir.","[26v-b] ¶ De questo scambiar de punta che m'e denanzi, essi questo zogho, che subito che lo scolar che m'e denanzi non metesse la punta in lo volto del zugadore, e'lassasela si'che non la metesse ne in lo volto ne in lo petto, e per che fosse lo zugador armado, Subito debia lo scolaro cum lo pe stancho inanci passare, e per questo modo lo debia piglare. E la sua spada metter a bon ferire poii che lo zugador a presa sua spada e non po fuzire."
"[39] Here we stand crossed near the ground: And more knowledge of plays will be given. This is another defense you can make against the thrust. When someone thrusts at you as described in the “Exchange of Thrusts”,[295] two plays before me, then you must advance and step off the line. You should do the same thing in this play, except that in the “Exchange of Points” you thrust back with your hands low and your point high, as I explained earlier. But in this play, which is named “Breaking the Thrust”,[296] you proceed with your hands high and as you advances and step off the line you strike downwards, crossing the opponent’s thrust at mid-sword, and driving it to the ground. Then you quickly close to grapple.[297]",,"[26v-c] ¶ Questa si'e un'altra deffesa che se fa contra la punta zoe quando uno ti tra una punta come t'o detto in lo scambiar de punta in lo segondo zogo che m'e denanzi che se de acresser e passar fora di strada. Chossi si die far in questo zogho, salvo che lo scambiar de punta se va cum punta e cum gli brazzi bassi e cum la punta erta dela spada come detto denanzi. Ma questo se chiama romper de punta che lo scolaro va cum gli brazzi erti e pigla lo fendente cum lo acresser e passare fora de strada e tra per traverso la punta quasi a meza spada a rebater la a terra. E subito vene ale strette."
"[40] I beat your point to the ground very quickly And in this way, I strike you without a doubt. The student who preceded me beat his opponent’s sword to the ground. Now I am going to complete his play, as follows: after I beat my opponent’s sword to the ground I stomp on it with my right foot.[298] This will either break it or prevent him from being able to lift it. But wait—there’s more. As soon as I have pinned his sword to the ground with my foot, I strike him with the false edge of my sword under his beard or into his neck. And then immediately I will return with a downward strike of my sword to his arms or his hands, as you see drawn here. [In the Pisani Dossi, the Scholar stomps with his left foot and his opponent's right foot is forward; the Scholar's opponent is also left-handed.]",,"[26v-d] ¶ Lo scolaro che m'e denanzi a rebatuda la spada del zugador a terra. & io complisco lo suo zogho per questo modo. Che rebattuda la sua spada a terra, io gli metto cum forza lo mio pe dritto sopra la sua spada. Overo che io la rompo, o la piglo per modo che piu non la pora curare. E questo non me basta, che subito quando gl'o posto lo pe sopra la spada, Io lo fiero cum lo falso dela mia spada sotto la barba in lo collo. E subito torno cum lo fendente dela mia spada per gli brazzi o per le man come depento"
"[41] From the crossing at the ground which the Scholar makes I come to cut your face because of my swiftness; And your sword will end up bent or broken And it will no more be able to work or deal. Here is another drawing of the “Breaking the Thrust” play, that you saw first two drawings previously. After I have beaten his sword to the ground I quickly pin it to the ground with my right foot, and then strike him in the head, as you see shown here. [In the Pisani Dossi, the Scholar stomps with his left foot and his opponent's right foot is forward.]",,"[27r-a] ¶ Anchora questo zogho del romper di punta ch'e lo segondo zogho che m'e denanzi. Ch'e quando io o rebattuda la spada a terra, subito io fiero cum lo pe dritto sopra la sua spada. E in quello ferire io lo fiero in la testa come voii vedete."
"[42] From the play that came before, I enter into this one: I make it quickly and cut your face. This is another play that flows from the “Breaking of the Thrust” play. After I break his thrust, if he raises his sword to cover as I strike upwards, I quickly drop the hilt of my sword inside his right arm, near his right hand, then I grab my blade near the point with my left hand, and then strike him in his face.[300] Or alternatively, if I chose, I could drive my sword edge into his neck, slicing him across his throat.",,"[27r-b] ¶ Questo e anchora un altro zogho del romper de punta, che si lo zugadore in lo rompere ch'i'o rotta la sua punta, leva la sua spada ala coverta dela mia subito io gli metto l'elzo dela mia spada dentro parte del suo brazo dritto apresso la sua mane dritta, E subito piglo la mia spada cum la mia man mancha a presso la punta, e fiero lo zugadore in la testa. E se io volesse, metteria la al collo suo per segargli la canna dela gola."
"[43] I will make you turn by pinching your elbow And with that, I will strike you without any delay. Also, after I have beaten aside or crossed my opponent’s sword, I can press my left hand to his right elbow and push strongly. This will turn him and leave him unprotected, after which I can strike him.",,"[27r-c] ¶ Anchora quando io, o, rebatuda la la punta o vero che sia incrosado cum uno zugadore, gli metto la mia mane dredo al suo cubito dritto, e penzolo forte per modo che io lo façzo voltare e discovrire, e poii lo fiero in quello voltare, che io gli faço fare."
"[44] Because of the turn that I have given you by the elbow I have quickly struck your head from behind. The student who preceded me spoke truly when he told you that he could turn the opponent and cut to his head. In addition, before you could turn back to make cover I would give you a major wound in your back with the point of my sword.",,"[27r-d] ¶ Questo scolaro che m'e denanzi dise lo vero che per la volta ch'ello ti fa fare per questo modo dredo de ti la testa ti vegno a taglare. Anchora inanzi che tu tornassi ala coverta, Io ti poria fare in la schena cum la punta una piaga averta."
"[45] I appear to come from the right, but I enter on the left To give you this thrust with great pain and harm; I make myself called Deceitful Thrust by name; And I am so cruel as I exchange the point of the sword. This play is named “The False Point” or “The Short Point”,[301] and I will explain how to do it. I make it look like I am making a powerful attack against my opponent with a crosswise strike to his head. As he makes cover I strike his sword but only lightly. Then I quickly turn my sword to the other side of his blade, gripping my sword with my left hand at about mid-sword. From there I can quickly make a thrust into his throat or chest. This play is however better in armor than without armor. [The Getty resembles the Pisani Dossi image.]",,"[27v-a] ¶ Questo zogo si chiama punta falsa e punta curta, e si diro come la fazzo. Io mostro de venire cum granda forza per ferir lo zugadore cum colpo mezano in la testa. E subito ch'ello fa la coverta, io fiero la sua spada lizera mente. E subito volto la spada mia del'altra parte piglando la mia spada cum la mane mia mancha quasi al mezo. E la punta gli metto subita in la gola o in lo petto. Ed'e miglore questo zogo in arme che senza."
"[46] To the Deceitful Thrust that you wanted to strike at me, I have struck the counter by turning myself and my sword Such that I have positioned my point in your face, In this way I have removed all of your plays. This play is the counter to the previous play, the False Point or the Short Point. And this counter is made like as follows: when the student strikes my sword lightly and then turns his sword around to the other side, I turn my sword around his in exactly the same way, stepping sideways to the left as I do so to gain his unprotected side. From here I can make a thrust into his face. And this counter is good both with or without armor.",,"[27v-b] ¶ Questo si'e lo contrario del zogho che m'e denançi, zoe de punta falsa overo di punta curta. E questo contrario si fa per tal modo. Quando lo scolaro fieri in la mia spada, in la volta ch'ello da ala sua spada Subito io do volta ala mia per quello modo che lui da volta ala sua. Salvo che io passo a la traversa per trovar lo compagno piu discoverto. E si gli metto la punta in lo volto. E questo contrario e bono in arme e senza."
"[47] Here ends the Wide Play of the sword in two hands, made up of plays that are all connected to each other, including remedies and counters from both the right and left sides, and counter-thrusts and counter-cuts to each situation, with breaks, covers, strikes and locks, all things that can be easily understood.",,"[27v-c] ¶ Qui finisse zogho largo dela spada a doii mani, che sono zoghi uniti gli quali ano zoghi, zoe rimedii e'contrarii da parte dritta, e de parte riversa. e contra punte e contra tagli de zaschuna rasone cum roture coverte, ferire e ligadure, che tutte queste chose liçerissima mente se pono intendere."
"[48] Here we begin the Narrow Play of the two handed sword, in which you will see all manner of covers, strikes, locks, dislocations, sword disarms and throws to the ground. There will also be the remedies and the counters needed for each situation, whether you are attacking or defending.","[16r-t] E qui comenza zogo de spada a doi mane, zogo stretto. E'l modo de rompe tute punte e tagli. In lo quale serano d'ogni rasone, coverte, feride, e ligadure, e dislogadure, e prese, e tore de spada, e sbatere in terra, per diversi modi. E serano gli remedii, e gli contrarii de zaschuna rasone che bisogna a offendere e difendere.","[27v-d] ¶ Qui cominza zogho de spada a doii man zogo stretto, in lo quale sara d'ogni rasone coverte, e feride e'ligadure. e dislogadure e prese, e tore de spade, e sbatter in terra per diversi modi. E sarano gli rimedii e gli contrarii de zaschuna rasone che bisogna a offender e a defender."
"[49] Because of the way that we stand here crossed, The play is given to whoever knows more and is swifter: But since many plays are made from such a crossing, We will only be making the strongest counters. We stand with crossed swords, and from this crossing either one of us can make all of the plays that follow. And as I told you earlier, these plays will follow one after the other. [In the Pisani Dossi, the Scholar is wearing a crown.]","[16r-a] Nui stasemo qui incrosadi e di questo incrosare che noii fazemo. Tuti gli zoghi che noii segueno fargle possemo. Acosi uno de noii, quale l'altro. E tuti gli zoghi seguirano uno l'altro como denanci e dito.","[28r-a] ¶ Noi stasemo qui incrosadi, e di questo incrosar che noii fazemo, tutti gli zoghi che noii segueno far gli possemo, chosi uno di noii quale l'altro. E tutti gli zoghi seguirano l'uno l'altro come denançi e ditto."
"[50] Because of your hilt which I hold in my hand, I will strike you and your sword will be pledged to me.  Using the crossing my Master made with his right foot forward, I now complete the first play as follows: I pass forward with my left foot, and I reach over my right arm with my left hand, seizing his sword-grip in the middle, between his hands. And from here I can strike him with either my edge or my point. This grip can be made when fighting with the two-handed sword or the one-handed sword. And I can make this grip by reaching either under or over the crossed swords.","[16r-b] Per lo incrosar che a fatto lo magistro cum lo pe dritto denanci io comprischo lo primo zogo, zoe che io passo cum lo pe stancho, e cum la mia mane stancha passo di sopra lo mio dritto brazo, e piglo lo suo mantenir dela spada sua, in mezo le soe[!] mane zoe in mezo delo mantenir. E cum taio e punta, Io lo posso ferir, e questa presa se po fare cosi a spada de una mane, come a doe mane, e cosi a incrosar de sotto mane come di sopra se po far tal presa.","[28r-b] ¶ Per lo incrosare ch'a fatto lo magistro, cum lo pe dritto denanci io complisco lo primo zogho, zoe Che io passo cum lo pe stancho e cum la mia mane stancha passo di sopra lo mio dritto brazzo, e piglo el suo mantenir di'sua spada in mezo le soe[!] mane zoe in mezo delo mantenir. E cum taglo e punta io lo posso ferir. E questa presa si po fare a spada d'una e de doii mane. & a incrosare tanto di sopra quanto di sotta mane si po far tal presa."
"[51] Because my sword has received a blow And because of this catch, my pommel strikes you in the face. This is another play that flows from the crossing of my Master. And from that crossing I can make this play and all of the others that follow. In this play I grip my opponent at the elbow as shown, and then strike him in the face with the pommel of my sword. After that I can also strike him in the head with a downward strike before he has a chance to make cover against me.","[16r-c] Questo e uno altro zogo che vene delo incrosar dello mio magistro. E como ello e incrosado ello po fare questo zogo e lli altri po che segueno de dredo, zoe ch'ello po fare overo piglare lo çugadore a questo modo, e ferirlo in lo volto cum lo pomo de sua spada. Anchora po ferirlo de fendente in la testa. Innanci ch'ello fare coverta presta.","[28r-c] ¶ Questo e un altro zogho che vene del incrosar del mio magistro. E commo ello e incrosado ello po fare questo zogo e'gl'altri che qui dredo siegueno. zoe, Che'lo zugadore po pigliare a questo modo lo zugadore, e ferirlo in lo volto cum lo pomo dela spada sua. Anchora po ferirlo de fendente in la testa, inançi ch'ello possa fare coverta presta."
"[52] This is another strike with my pommel, Following the quickness of the art and the Masters. This is another pommel strike, which is effective against a man with or without armor. Make this strike quickly if his face is unprotected, and you will certainly hurt him. I can tell you from experience that with this strike you’ll have him spitting out four teeth. From here, if you wish, you can also throw your sword around his neck, as my fellow student will show you next.","[16r-d] Questo e uno altro ferir de pomo e se po far subito, se lo volto e discoverto fallo senza dubito, Che lo se po fare armado e disarmado. Quatro denti fora butta de boccha a uno cum tale zogo, che l'a provado. E lla spada se volesse al collo te poria butar come fa dredo da mi quello scolaro.","[28r-d] ¶ Questo e un'altro ferir de pomo. E se po far subito Si lo volto a discoverto, fa lo senza dubito. Che ello si po fare armado e disarmado. Quatro denti butta Fior[!] di bocha a uno cum tal zogo, si ch'el l'a provado. E la spada al collo se volesse te poria butare, como fa dredo a'mi quello scolare."
"[53] I send you to the ground in this match; I have not failed to thrust my sword to your neck. As the student who preceded me told you, after doing the previous play I now put the sword-edge into your neck. And from here, if I discover that you have no neck armor, I will easily cut your throat.","[16v-a] Per lo zogo che m'e denanci, e como lo scolar ha ditto io t'o posta la spada al collo. E lla gola te posso ben taglar. Per o ch'io sento che tu non ai punto di colaro.","[28v-a] ¶ Per lo zogho che m'e denanzi e como lo scolar a ditto io t'o posta la spada al collo, e la gola te posso ben taglare, per che i sento che tu non hai punto de colare."
"[54] From the right cover I have caught you so well, That I will lay you out on the ground.","[15r-c] Questo zogo se fa per tal modo zoe che uno vada cum lo colpo mezano contra lo mezano de parte riversa e subito vada cum coverta ale strette. E buta la sua spada alo collo dello compagno, piglando la sua mane dritta cum la sua stancha de si in stesso come aqui dipento. Butarlo po in terra senza falimento metendo lo suo pe dritto dredo lo suo dritto.",
"[55] This play is performed as follows: against a crosswise strike from his left, you meet it with a crosswise strike of your own from your left.[304] Then you quickly move to close range under cover, and then throw your sword around your opponent’s neck, as you see drawn here. From here you can easily throw him to the ground. [In the Pisani Dossi, the Scholar's right foot is outside (in front) of his opponent's right foot.]","[15r-d] Questa e una altra presa de butar uno in terra cum tuta la spada. Zoe che aquesto scolar incrosa cum lo zugadore della parte dritta e passa ale strete, e cum la mane sua stancha penze lo cubitto dritto del zugadore. E subito gle butta la spada al collo piglando la sua propia spada al mezo. Ello suo dritto pe dredo lo suo dritto dello zugadore. Acosi lo butta[305] in terra cum pocho honore.","[30r-b] ¶ Questo zogho se fa per tal modo zoe che uno vada cum lo colpo mezano contra lo mezano de parte riversa e subito vada cum coverta ale strette, e butti la spada al collo del compagno como qui e depento. Buttar lo po in terra senzo fallimento."
"[56] If he covers from his right side, seize his sword with your left hand as shown and strike him with a thrust or a cut. Then after striking him hard, if you wish, you can drop your own sword and cut his face or neck with his own sword, in the manner shown by the student in the next picture.[307]","[15v-a] Questo e uno altro modo de butar uno in terra. E si fa per tal modo lo scolar se incrosa cum lo zugadore dela parte dritta, e si vene ale strette. E cum la mane stancha pigla la spada delo zugadore passando la mezamento della spada, e subito butta la sua spada in terra, e quella del zugadore propia, gle mette al collo piglando lo mantenir al mezo zoe in mezo dela mane del zugadore. E cum lo suo pe dritto dredo lo suo dritto, e per tal modo lo butar in terra cum la sua spada propria.","[29r-d] ¶ Se uno se covra dela parte dritta, piglia cum la tua mane stancha la sua spada per questo modo, e fierilo di punta voii cum lo taglio. E se tu voii tu gli tagli cum la sua spada lo volto o voii lo collo per lo modo ch'e depinto. Anchora quando io t'o ben ferido, io posso abandonar la mia spada e pigliar la tua per lo modo che fa lo scolaro che m'e di dredo."
"[57] I have in hand the catch that I have sought with you For throwing you to the ground with your sword. Following on from the play of the student before me, I cut my opponent’s face with his own sword, then force him to the ground. Here I am demonstrating just how effective this art really is.","[15v-a] Questo e uno altro modo de butar uno in terra. E si fa per tal modo lo scolar se incrosa cum lo zugadore dela parte dritta, e si vene ale strette. E cum la mane stancha pigla la spada delo zugadore passando la mezamento della spada, e subito butta la sua spada in terra, e quella del zugadore propia, gle mette al collo piglando lo mantenir al mezo zoe in mezo dela mane del zugadore. E cum lo suo pe dritto dredo lo suo dritto, e per tal modo lo butar in terra cum la sua spada propria.","[29v-a] ¶ Del zogho del scolaro che m'e denanzi, si fazo questo zogho, cum la sua spada gli taglio Lo volto mandandolo in terra. Ben ti mostraro che tal arte sia vera."
[58] This is the cover of the backhand For making plays of the greatest deceptiveness.,,
[59] From the cover of the backhand have I enclosed you here: You will not be defended from the narrow play nor from strikes.,,
[60] This is a strong catch that comes from the backhand: You are finished striking and your sword is lost.,,
"[61] If he covers from his left side, grab his left hand including his pommel with your left hand, and pull it upwards and backwards. From there you will be able to strike him with thrusts and cuts.",,"[29r-c] ¶ Se uno se covra dela parte riversa, pigla cum la sua mane stancha cum la sua man stancha cum tutto lu pomo dela sua spada, e penzilo in dredo, e cum punta e taglio ben lo po ferire."
"[62] In this fashion I have bound you so well That you would be trapped in armor or without: And your sword will be useless against me; I make this counter of the taking of the sword with certainty. If I am crossed at Narrow Play with someone, I can quickly make this move[308] to prevent him from attacking me by taking my sword, or a lock.","[16v-d] Questo si e uno altro contrario che contra lo tore de spada e fe[!] fa presto e subito per tale modo. Quando uno si vene tego a incrosare, o passa, o acrese stretto cum lo pe stancho denanci, e la tua mane stancha pigla la sua mane in la zuntura della sua mane per sotto lo so mantenir. E volta la sua spada in verso parte riversa per tale modo ch'e aqui dipento. E si lo fieri in lo petto, o in lo ventre o vero li che meio[!] gle piase.","[30r-a] ¶ Se io incroso ale strette cum uno. Subito fazo questa presa, per che ne cum tor di spada ne cum ligadure non mi faza offesa. Anchora lo posso ferire de punta e de taglio senza mio periculo."
"[63] When I am crossed I move to the Narrow Game, and I place the hilt of my sword between your two hands. Then I push your two hands upwards so that your sword is high. From here I throw my left arm over your arms from the left, binding[309] them with your sword pinned under my left arm. Then I will strike multiple times until I am exhausted. The student who follows me will show you what happens next.",,"[28v-d] ¶ Quando io son incrosado io vegno al zogho stretto. Ello elzo dela mia spada enfra le toii mane metto. E levo le toii brazze cum la tua spada in erto. E'llo mio brazo stancho butero per sopra li toii a man riversa, e serero li toii brazi cum la tua spada sotto lo mio brazzo mancho. E de ferir non ti lassaro in fin che saro stancho. Lo zogo che m'e dredo che fa lo scolaro. Ello e mio zogo, e quello te voglio fare."
"[64] I enclosed your arms with my left arm, And this play is better armored than unarmored: Also, I counter the taking of the sword, According to where Master Fiore put me. The student who is before me has completed the play which I said to do. Your arms have been bound in ligadura mezana (middle bind). Your sword is prisoner, and it can not help you. And with mine I can cause you a lot of injuries. Without doubt I can put my sword to your neck. I can immediately do the play which is after me.",,[29r-a] ¶ Del scolaro che m'e denançi io complisco'l zogho. e quello che luii di far a ditto io l'o fatto. Le braze t'o ligade in ligadura mezana. La tua spada e in prisone e non ti po iutare. E cum la mia feride asaii te posso fare. La mia spada ti posso metter al collo senza dubito. E'l zogo che m'e dredo te posso far subito.
"[65] This play follows on from the previous one, where the student struck his opponent multiple times while using his left arm to keep the opponent’s arms and sword pinned. Now I throw my sword at my opponent’s neck as depicted. Then I throw him to the ground to complete the play.",,"[29r-b] ¶ Del zogho che denançi si fa questo zogho, che quando lo scolaro a ben ferido lo zugadore tegnando gli brazzi cum la spada ben ligadi cum lo suo brazzo mancho la sua spada gli buta al collo e metilo in questo partito. Se io lo butto in terra lo zogho o complito."
"[66] I have enclosed your hand with my sword, And I will strike you a bargain with many strikes to your head; And I make the counter to the middle taking of the sword: This bind I have made which arises thus.",,
