"[16] The Middle Iron Gate (Stable) The Middle Iron Gate, I am strongest For giving death with thrusts and downward blows: And by extending my sword, I feel that From the narrow play I always defend myself. This is Half Iron Door, because it stays in the middle and is a strong guard. But, she wants a long sword. She throws strong thrusts and beats with force the swords upwards, and returns with a downward blow for the head or arms, and returns to its guard. But it is called Door, because it is strong and it is a strong guard that badly it can break without danger, and without coming to the close.","[12r-d] Questa e meza porta di ferro perche sta in mezo, e de una forte guardia ma ella non vole longa spada, ella zetta forte punte, e rebatte per forza le spade in erto, e torna cum lo fendent per la testa o per gli brazi, e pure torna in sua guardia. Per zo vene chiamada porta, per che ella e forte. E de forte guardia che male se po rompere senza pericolo a venir ale strette.","· Porta di ferro mezana, stabile · [24r-b] ¶ Questa e mezana porta di ferro per che sta in mezo. & e una forte guardia, ma ella vole longa spada. Ella butta forte punte, e rebatte per forza le spade in erto, e torna cum lo fendente per la testa o per gli brazzi, e pur torna in sua guardia. Pero ven chiamata porta per che la e forte E'de forte guardia che male se po rompere senza periculo e venire ale strette."
"[17] The Extended Stance (Fluid) I am the Extended Stance with my short sword And I often strike the throat with cunning. This guard is the Long Guard, which is full of deception. She is skilled in probing[250] the guards to see if she can deceive her opponent. If she needs to strike the opponent with a thrust, she is well-suited to do it. As for the opponent’s blows, she knows how to avoid them and then strike back with blows of her own. This guard employs deception more than any other guard.","[12v-a] Questa si e posta longa ch'e piena de falsita. Ella va tastando le guardie se lo compagno po inganar. S'ella po ferire de punta ella lo sa ben fare, gli colpi ella schiva e poi fiere s'ella lo po fare. Piu che le altre guardie le falsitade sa usare.","· Posta longa, Instabile · [24r-a] ¶ Posta longa si'e questa piena di falsita. Ella va tastando le guardie se lo compagno po ingannare. Se ella po ferir de punta la lo sa ben far E gli colpi la schiva, e po fieri s'ella lo po'fare. Piu che le altre guardie, le falsita sa usare."
"[18] The Frontlet Stance called the Crown (Fluid) The Frontlet Stance, I am called the Crown; I pardon no one, not from the edge nor from the point. This is the Forehead Guard,[251] called by some instructors[252] the Crown Guard. She is a very good guard for crossing swords,[253] and is also very good against thrusts. If she is attacked with a high thrust, she crosses swords while stepping off line. If she is attacked with a low thrust, she also steps offline, but this time she drives the opponent’s sword to the ground. She can also do other things. For example, in response to a thrust she can pass backwards with the front foot and respond with a downward strike to the head or arms, ending in the Boar’s Tusk, then she can quickly throw a thrust or two with advancing steps, then deliver a downward strike, ending in that same guard.","[12v-b] Questa si e posta frontale e alchuni magistri la chiamano posta di corona. Che per incrosar ella e bona, e per le punte, ella e anchora bona che se la punta gle vene trata erta ella la incrosa passando fora de strada. E se lla punta si ven trata bassa anchora passa fora de strada rebatendo la punta a terra. Anchora po fare altramente, Che in lo trar dela punta torni cum lo pe indredo, e vegna di fendenti per la testa e per gli brazi e vada in dente do zenghiaro e subito[255] bute una punta, o doe cum acreser de pe, e torni[256] di fendent cum quella propria guardia.","· Posta frontale ditta corona Instabile [24v-c] ¶ Questa si'e posta frontale, chiamada d'alchuni magistri posta di corona, che per incrosar ella e bona, e per le punte ell'e ancora bona, che se la punta gle ven tratta erta, ella la incrosa passando fuora di strada. E se la punta e tratta bassa, anchora passa fuor di strada rebattendo la punta a terra. Anchora po far altra mente, che in lo trar dela punta torni cum lo pe indredo e vegna da fendente per la testa e per gli brazzi e vada in dente di cengiaro e subito butti una punta o doe cum acresser di pe e torni di fendente in quella propia guardia."
"[19] [The Stance of the Queen on the Right] Again, I am the Stance of the Queen against the Boar's Tusk; With malice and trickery, I will give of [my sword] in a brawl.","[12v-c] Questa si e posta de donna che po tuti gli setti colpi fare della spada fare. E de tuti colpi ella se po covrire. E rompe le altre guardie per grandi colpi che po fare. E per scambiar una punta ella e sempre presta. Lo pe ch'e denanci acrese fora de strada, e aquello de dredo passa ala traversa. E lo compagno fa romagnire discoverto. E aquello po ferir subito per certo.",
"[20] The Wild Boar's Tusk (Stable) I am the strong Stance of the Boar's Tusk. My tactic against all the guards is to probe. This is the Boar’s Tusk,[261] because it strikes the way the wild boar strikes.[262] Sometimes it makes powerful thrusts from below up into the face, without stepping forward, and it returns along the same path with a downward strike to the arms. Other times as it thrusts the point of the sword high into the face, it advances the front foot forwards, then returns to its guard with a downward strike to the head or the arms. Then it quickly launches another thrust with another advance of the front foot. And this guard can mount a good defense against the Narrow Game.","[12v-d] Questo si e dente de zenghiar, che dello dente de zenghiar fa simile modo de ferir. Ello tra grande punte, per sotto le mane in fin al volto, e non se move de passo, e torna cum lo fendente, zo per li brazi. E alchuna volta tra la punta al volto, e va cum la punta erta, e in quello butar de punta, ello acrese lo pe ch'e denanzi subito, e torna cum lo fendente per la testa, e per li brazi, e torna in sua guardia, e subito zetta un'altra punta cum acresere de pe, e ben se defende dalo zogo streto.","· Dente di cenghiaro stabile · [24r-d] ¶ Questo si'e dente di zengiaro pero che dello zengiaro prende lo modo di ferire. Ello tra grande punte per sotto man in fin al'volto e no si move di passo, E torna cum lo fendente zo per gli brazzi. E alchuna volta tra la punta al volto, e va cum la punta erta, e in quello zitar di punta ello acresse lo pe ch'e dinanzi subito, e torna cum lo fendente per la testa e per gli brazzi e torna in sua guardia, e subito zitta un'altra punta cum acresser di pe, e ben se defende delo zogo stretto."
"[21] The Shortened Stance (Stable) I am the Shortened Stance and I have the length of the sword; Often I thrust the point and then return with cunning. This is the Short Guard that is more effective with a longer sword. It is a deceptive guard but it is risky to wait in. It is constantly moving, trying to see if it can enter with a thrust and a step against the opponent. And this guard is more effective in armor than without armor.","[13r-a] Questa si e posta breve che vole longa spada, ed e una maliciosa guarda che non ha stabilita. Anche sempre se move, e guarda se po intrar cum punta e con passo contra lo compagno, e piu e apropiada tal guardia in arme che senza arme.",· Posta breve stabile · [24r-c] ¶ Questa si e posta breve che vole longa spada & e maliciosa guarda che non a stabilita. Anche sempre si move e vede se po entrar cum punta e cum passo contra Lo compagno. E piu e apropiada tal guardia in arme che senz'arme.
"[22] The Stance of the Queen on the Left (Powerful) I am the left Stance of the True Window; I am just as swift in this one as from the right. This is the Guard of the Lady on the left, and she is always quick to cover or strike. She generates powerful blows and easily breaks the thrust, driving it to the ground. Also, because of her skill in traversing, she can quickly enter into the Narrow Game, a game she is very familiar with.","[13r-b] Questa si e posta de donna la sinistra che de coverte e de ferire ella e sempre presta. ella fa grandi li[266] colpi e rompe le punte, sbattele a terra. E intra in lo zogo stretto, per lo saver atravesare. Aquisti zoghi tal guardia sa bene fare.","· Posta di donna la sinestra, pulsativa · [23v-d] ¶ Questa si e posta di donna la senestra, che de coverte e de ferir, ella e sempre presta. Ella fa grandi colpi e rompe le punte, e sbattele a terra. E intra in lo zogho stretto per lo suo saver traversare. Questi zogi tal guardia sa ben fare."
"[23] The Stance of the Long Tail (Stable) Stance of the Long Tail, I am extended to the ground Forward and backward, I always make offense: And if I step forward and enter with a downward blow, I come to the narrow play without fail. This is the Long Tail Guard Guard that extends behind you down to the ground. She can attack with a thrust, and can also move forwards to cover and strike. And if she passes forward while striking downwards she can easily enter the Narrow Game. This is a good guard to wait in, because you can quickly transition from it into other guards.","[13r-c] Questa si e posta de coda longa ch'e distesa in terra de dredo ella po mettere punta, e denanci po covrir e ferir. E s'ello passa innanci e tra delo fendente. In lo zogo stretto intra senza falimento. Che tale guardia e bona per aspetare. Che de quella in le altre tosto po intrare.","· Posta di choda longa stabile · [24v-a] [268]¶ Questa si e posta di coda longa ch'e destesa in terra di dredo, ella po metter punta, e denançi po covrir e ferire. E se ello passa inançi e tra del fendente, in Lo zogo stretto entra senza fallimento, che tal guardia e bona per aspettare, che de quella in altre tosto po intrare."
"[24] The Two-Horned Stance (Fluid) I make myself called the Stance of the Anvil If I have enough deceit, I will not challenge it. This is the Two Horned Guard, which is held so strongly locked in position that its point cannot be moved off the center line. And this guard can do all of the things that the Long Guard can do. And the same is true of the Window Guard and the Forehead Guard. [In the Novati, the left hand is not reversed; this may be due to an error on the part of the artist hired to clean up the Pisani Dossi manuscript images before publication.]","[13r-d] Questa e posta de bicorno che sta cosi serada che sempre sta cum la punta per mezo la strada E aquello che po fare posta longa po far questa E similmente dico de posta di fenestra, e posta frontale.","· Posta di Bichorno instabile · [24v-b] ¶ Questa e posta di bicorno che sta cossi serada, che sempre sta cum la punta per mezo dela strada. E quello che po fare posta longa, po fare questa. E simile mente dico de posta di Fenestra. e di posta frontale."
"[25] The Stance of the Boar's Tusk in the Middle (Stable) This is the Middle Boar’s Tusk, so named because the boar has two tusks, one low and this one in the middle, by which I mean this one stays on the center line. And the Middle Boar’s Tusk can do whatever the Low Boar’s Tusk can do. Just as the wild boar strikes diagonally with its tusks, so you strike diagonally with your sword, in such a way as to displace[272] your opponent’s sword, from which position, having uncovered your opponent, you can launch thrusts, or destroy his hands, head or his arms.",,"· Posta di dente zenchiaro mezana, stabile · [24v-d] ¶ Questo si'e dente di cengiaro lo mezano, e per ço che sono doii denti di zengiaro l'uno tutto, l'altro si'e mezo, pero e ditto mezo, per zo ch'ello sta in mezo dela persona, e zo che po fare lo tutto dente, po fare lo mezo dente. E per modo che fieri lo zengiaro a la traversa, per tal modo se fa cum la spada che sempre fieri cum la spada ala traversa dela spada del compagno. E sempre butta punte e discrova lu compagno, e sempre guastagli le mane e tal volta la testa e'gli brazzi."
"[26] I am the sword, deadly against all weapons. Neither spear, nor poleaxe, nor dagger can prevail against me. I can be used at long range or close range, or I can be held in the half sword grip and move to the Narrow Game. I can be used to take away the opponent’s sword, or move to grapple. My skill lies in breaking and binding. I am also skilled in covering and striking, with which I seek always to finish the fight. I will crush anyone who opposes me.[273] I am of royal blood. I dispense justice, advance the cause of good and destroy evil. To those who learn my crossings I will grant great fame and renown in the art of armed fighting.",,"[25r-t] ¶ Spada son contro ogni arma mortale, ne Lanza ne Azza ni daga contra mi vale. Longa e curta me posso fare. e me strengho e vegno alo zogho stretto, e'vegno allo tor de spada e allo abrazare mia arte si'e roture e ligadure so ben fare de coverte e ferire sempre in quelle voglio finire, chi contra me fara, ben lo faro languire. E son Reale e'mantegno la Justicia, la bonta acresco e destruzo la malicia. Chi me guardera fazendo in me crose, de fatto de armizare gli faro fama e vose."
"[27] By crossing with you at the tip of the sword I have settled my point in your chest from the other side. Here begins the Wide Play of the sword in two hands.[274] This Master who is crossed at the point of his sword with this player says: “When I am crossed at the points, I quickly switch my sword to the other side, and strike him from that side with a downward blow to his head or his arms. Alternately, I can place a thrust into his face, as the next picture will show.” [In the Pisani Dossi, the player is wearing a crown.]","[13v] Aqui comenza zogo largo de spada a doe mane cum pocho incrosare, lo honore sera de chi meio savera fare. [13v-a] Questo magistro ch'e aqui incrosado cum questo çugadore dise quando io sono incrosado in punta de spada subito io do volta ala mia spada, e si lo fiero del'altra parte cum lo fendente zoe per la testa, e per gli brazi, overo o ch'io gli metto una punta in lo volto. Como vuii vederite qui de dredo da mi dipento.","[25r-c] ¶ Qui cominza zogho di spada a doii man zogho largo. Questo magistro ch'e qui incrosado cum questo zugadore in punta de spada, dise quando io son incrosado in punta de spada, subito io do volta ala mia spada e si lo fiero dal'altra parte cum lo fendente zo per la testa e per gli brazzi, overo che gli metto una punta in lo volto, come vederi qui dredo depinto."
"[28] With the strike of which the Master spoke who came before, I have quickly put the point of my sword in your throat. I have placed a thrust into his face, as the previous Master said. Also, I could have done what he told you, that is, when my sword was crossed on the right I could have quickly switched sides to the left, striking his head or arms with a downward blow.”[275]","[13v-b] Io te ho posto una punta in lo volto, como lo mio magistro ch'e denanci dise. Anchora poria avere fato zo ch'ello dise, zoe avere trato de mia spada, subito quando io era apresso lo incrosare della parte dritta dell'altra parte zoe della stancha io debeva voltare subito la mia spada in lo fendente per in la testa e per gli brazi como ha ditto lo magistro mio ch'e denanci.","[25r-d] ¶ Io t'o posta una punta in lo volto come lo magistro ch'e denanci dise. Anchora poria aver fatto zo ch'ello dise zoe aver tratto de mia spada subito quando io era apresso lo incrosare dela parte dritta. del'altra parte zoe dela stancha io debeva voltare la mia spada in lo fendente per la testa e per gli brazzi, como a ditto lo mio magistro ch'e denançi."
"[29] By crossing at mid-sword, I will strike your left arm; I will do this quickly because time is short.  I too am crossed in the Wide Play, but this time at the middle of the swords. And immediately after making my cross I let my sword drop down[276] to slide forwards and backwards over his hands. Or, if I choose to pass forward with my right foot and move offline, I can then make a thrust into your chest, as you will see drawn next. [In the Pisani Dossi, the player is wearing a crown.]","[13v-c] Anchora me incroso qui per zogo largo, a meza spada. E subito quando io sono incrosado io lasso discorere la mia spada sopra le suie mane, e se voglo passare cum lo pe dritto fora de strada io gli posso mettere una punta in lo petto come vui vedite qui dredo dipento.","[25v-a] ¶ Anchora me incroso qui per zogho largo a meza spada. E subito che son incrosado, io lasso discorrer la mia spada sopra le soi mane, e se voglio passare cum lo pe dritto fuora de strada, io gli posso metter una punta in lo petto, come qui dredo e depento."
"[30] From the Master who crosses at mid-sword, I strike you a bargain with that which he has said. Here you see me completing the play of my teacher. I have made his cover, and then immediately I do what he said to do, that is I strike first to my opponent’s arms, and then I continue with a thrust into his chest.","[13v-d] Lo zogho delo mio magistro io l'o compido, che i'o fatto la sua coverta. E subito, o fatto el suo ditto. Che i'o feridi prima gli brazi, e poii gle ho posta la punta in lo petto.","[25v-b] ¶ Lo zogho del mio magistro io l'o complido, che io o fatta la sua coverta, e subito o fatto lo suo ditto, che io o'ferido prima gli brazzi, e poii gl'o posta la punta in petto."
"[31] Also from this same crossing I have grasped your sword in this way: And before your sword escapes my hand, By striking I will deal with you like a foul villain. My master previously[280] instructed me that when I am crossed at mid-swords with my opponent, I should immediately advance forward and seize his sword as shown, and then strike him with a cut or a thrust.[281] Also I could destroy his leg as you see drawn next, by stomping with my foot against the side of his knee or under the kneecap.[282]","[14r-a] Ello mio magistro che m'e denanci m'a insegnato che[283] quando a meza spada io son cum uno incrosado che subito me debia acresere in denanci e piglare la sua spada a questo partito, per ferirlo taglo, o punta. Anchora gle posso guastare la gamba per lo modo che voi possete vedere aqui dipento a ferirlo cum pe sopra la schena della gamba, overo sotto lo zinochio.","[25v-c] ¶ El mio magistro ch'e denanzi m'a insegnado che quando a meza spada io son cum uno incrosado che subito mi debia acresser inanci, e piglar la sua spada a questo partido per ferirlo taglo o punta. Anchora gli posso guastar la gamba per lo modo che possi vedere qui depento a ferirlo cum lo pe sopra la schena dela gamba overo sotto lo zinochio."
"[32] There is no question of the saying of the earlier Master, And I make with intent the play that he has said. As the previous student told you, our Master taught us this technique.[284] Here I show you how it’s done, and as you can see my opponent can do nothing to stop me.","[14r-b] Lo scolar che m'e denanzi dise del suo magistro, e mio che llo gle ha insignado questo zogo, e per vezuda io lo fazo. A farlo senza dubio ello m'e pocho impazo.","[25v-d] ¶ Lo scholaro che m'e denanzi dise del suo magistro e mio ch'ello gli ha insegnado questo zogho, e per vizuda io lo fazo. A farlo senza dubio, ello m'e pocho impazo."
"[33] I have uncovered you well by stepping out of the way And I will surely strike your arm while turning. This play is named “The Peasant’s Strike”[285] and you do it like this: take a narrow stance[286] with your left foot forward, and wait for the Peasant to attack first with his sword. When he launches his attack, immediately advance your left foot to the left off the line,[287] and step diagonally off line to the left with your right foot, receiving his strike in the middle of your sword. Now let his sword slide off yours to the ground, and then quickly counter-attack with a downward strike to his head or arms, or a thrust into his chest as you see drawn in the next picture. This is also a good play if you are fighting sword versus poleaxe, or against a heavy or light staff. [In the Getty, the Master is missing his crown.]","[14r-c] Questo zogo e chiamado lo colpo del vilano, e si fa per tal modo. Zoe che si de aspetare lo vilano ch'ello traga cum sua spada. E quello che aspeta lo colpo di stare in picolo passo cum lo pe stancho denanci. E in quello che lo vilano te tra per ferirte. Acrese lo pe stancho fora de strada inverso la parte dritta. E cum lo dritto pe passa ala traversa fora de strada, piglando lo suo colpo a meza spada e lassa discorere la sua spada a terra, e subito respondigli cum lo fendente per la testa overo per gli brazi overo cum la punta in lo petto come qui dipento. ancora questo e bono.","[26r-a] ¶ Questo zogho si'e chiamado colpo di villano e sta in tal modo, Zoe che si de aspettare lo villano che lo traga cum sua spada. E quello che lo colpo aspetta de stare in picolo passo cum lo pe stancho denanzi. E subito che lo villano ti tra per ferire, acresse lo pe stancho fora de strada inverso la parte dritta, E cum lo dritto passa ala traversa fora de strada pigliando lo suo colpo a meza la tua spada. E lassa discorrer la sua spada a terra, e subito responde gli cum lo fendente per la testa overo per gli brazi, overo cum la punta in lo petto come depinto. Anchora e questo zogho bon cum la spada contra la Azza, e contra un bastone grave o liziero."
"[34] The strike to your arms, that play I make, And from the narrow play I will cause you other trouble. In the previous drawing you saw the Peasant’s Strike, in which you saw a thrust well-placed into the attacker’s chest. And alternatively he could have struck a downward blow to the opponent’s head or the arms, as I explained previously. Also, if the opponent seeks to counter me by striking back up with a rising blow to my arms from the left, I quickly advance my left foot and place my sword over his, and from this position he can do nothing to me.","[14r-d] Questo e lo colpo del vilano ch'e qui denanci de mi. Che bene gle ho posta la punta in lo petto. E cosi gle posseva fare uno colpo per la testa, e per gli brazi cum lo fendente como e ditto denanci. Ancora s'eio[!] volesse lo zugadore contra de mi fare che ello volesse ferirme cum lo riverso sotto gli mie brazi. Io subito acrescho lo pe stancho e meto la mia spada sopra la sua, e non mi po far niente.","[26r-b] ¶ Qui denanci si'e lo colpo del villano, che ben gl'o posta la punta in lo petto. E cossi gli posseva un colpo per la testa fare e'per gli brazzi cum lo fendente comme ditto denanzi. Anchora se'l zogadore volesse contra de mi fare volendo mi ferire cum lo riverso sotto gli miei braççi, io subito acresso lo pe stancho, e metto la mia spada sopra la sua. e non mi po far niente."
"[35] When a sword flies for your leg Make a downward blow to his face or around to his throat: His arms will be wasted more quickly than his head, Because the distance is manifest for a shorter time. If your opponent strikes to your leg, withdraw your front foot, or pass backwards and strike downwards to his head, as shown in the drawing. With a two handed sword it is unwise to strike to the knee or below, because it is too dangerous for the one striking. If you attack your opponent’s leg, you leave yourself completely uncovered. Now, if you have fallen to the ground, then it is all right to strike at your opponent’s legs, but otherwise it is not a good idea, as you should generally oppose his sword with your sword.","[14v-a] Quando uno te tra per la gamba, discrese lo pe ch'e denanci. O tu lo torna indredo e tra dello fendent per la sua testa. Come aqui dipento. Ben che cum spada a doe mane non se de trare dello genochio in zu, perche e tropo grande pericolo aquello che tra. Che lo romane tuto discoverto quello che tra per la gamba. Salvo che se uno fosse cazuto in terra, ben se poria trar per gamba. Ma altramente non stando spada contra spada.","[26r-c] ¶ Quando uno te tra per la gamba, discresse lo pe ch'e denanzi. O tu lo torna in dredo. e tira del fendente per sua testa come qui depento. Ben che cum spada de doii man non si de trare del zinochio in zu. Pero ch'e troppo grande pericolo a choluii che tra. Ch'ello rimane tutto discoverto quello che tra per gamba. Salvo che se uno fosse cazudo in terra poria si ben trar per gamba. Ma altra mente no, siando spada contra spada."
"[36] When I am crossed with someone and come to the narrow, I strike his testicles with my right foot. This play, where I strike you with a kick to the groin, is made to hurt you so much that your cover will falter. When you make this play you should do it quickly, to prevent your opponent from being able to counter it. The counter to this play must be done quickly, and is made by the player grabbing the student’s right leg with his left hand, and then throwing him to the ground.","[14v-b] Aquesto partito che io te fiero cum lo pe in gli coglura el fazo per farte doia, e per farte svariarte la coverta che fazando questo zogo vole essere fato subito, per non aver dello contrario dubito. Lo contrario de questo zogo vole essere presto fatto zoe che lo zugadore de piglare per la gamba dritta lo scolaro, cum sua mane stancha e in terra lo po butare.","[26r-d] ¶ Questo partido che io ti fiero cum lo pe in li cogloni el fazo per far te doglia e per far te svariare la coverta. Che fazando questo zogho vol esser fatto subito, per non avere del contrario dubito. Lo contrario di questo zogo vol esser presto fatto, zoe che lo zugador de piglare per la gamba dritta lo scolaro cum sua mano stancha, e in terra lo po buttare."
