"[18] The next is a hit in quarte against an opponent who has lunged in quarte. You had engaged your adversary;s[!] faible on the outside with the high guard shown in the previous plates; he has tried to disengage and lunge in quarte on the inside in the path which appeared to him to be uncovered. But with your arm high and held back you have pressed on his faible with a guard of quarte, and by carrying the right foot forward and somewhat out of the straight line and bending the body over it, you have made a hit in the throat. By continuing with the left foot you would have passed right to his body. If the adversary had tried to turn with either foot, he would have been all the weaker, and therefore you would have hit in the straight line or in the back.","[169] QVEST’ ALTRA, CHE SEGVE SARA VNA QVARTA, CHE FErisce un’ altra quarta, laquale si era portata inanzi per ferire à piè fermo, nata perche collui che hà ferito haueua aquistato il debile nimico dalla parte di fuori con quella guardia alta, che si è ueduta nelle figure antecedenti, & perciò l’ altro hà uoluto cauare, & ferire di quarta di dentro à piè ferino per quello scoperto, che li pareua uedere; mà il fetittore che si trouaua col braccio alto ritirato lo hà appoggiato di quarta nel debile nimico portando il destro piede inanzi alquanto fuori della retta linea, & con piegarli sopra il corpo nà ferito il nimico nella gola, & continoua oltre col sinistro sino, che passa del tutta al corpo nimico, ne meno l’haurebbe ferito, se bene anco esso nimico si fosse girato con qual piede hauesse uoluto, perche tanto più debile sarebbe stato, & perciò l’haurebbe ferito nella giustezza ò nella schiena. 120."
"[19] The next is a hit in seconde made by passing underneath with the body on the outside, against a guard turned somewhat towards quarte. You were in a high tierce, with the hilt near your face and advancing towards the outside; the adversary in tierce in a straight line, seeing you coming, raised his point to impede your sword and cover himself above. Being already within distance you have left your hand at that height, turned to seconde, before he could reach your sword, and by bending your body as far forward as possible have passed, With the head so far advanced as to penetrate the whole length of his blade; thus you have hit, and the adversary has been unable to defend, nor has had time to bring his sword back into line or to turn his body.","[170] MA QVELLA, CHE VERA APPRESSO SARA VNA FERITA DI seconda, & col corpo che passa di sotto dalla parte esteriore contra una mano alquanto riuolta uerso la quarta, caggionatasi, perche quello che hà ferito si ritrouaua nella terza alta col finimento appresso il uiso, come si uidde, & ueniua caminando oltre per andare dalla parte di fuori; & perche l’ altro, che staua in terza retta, uedendolo uenire, hà alzata la punta per impedire la nimica, & coprirsi disopra, ma il ferittore, ilquale già era in misura lasciando la mano in quella altezza hà uoltato in seconda inanzi che ’l nimico habbia potuto ariuare alla spada, & piegando quanto più hà potuto il corpo è uenuto à passare con la testa tanto oltre che è penetrato con essa tutta la lama nimica, & così è andato à ferire, che l’auerssaria non hà potuto diffendere ne meno hà potuto hauere tempo di tornare con la punta in presenza ne di girare il corpo. 121."
"[20] This plate illustrates the exclusion of an opponent's sword in low tierce. You were in high tierce and have lowered your body as you advanced, so that on arriving within distance you were so low that you have controlled the adversary's sword without moving your arm. While lowering your body you have carried the right side back and the left forward and so balanced the body on the feet and knees, that you have been able to get so low with great swiftness. The position of your body is such that even if your adversary had disengaged above, you would not have checked your advance or made any defence since there was nothing to defend in that line. Whether he had disengaged or not, or whatever he had chosen to do, he would not have prevented your advance, with your sword, feet and body working in union. The change in the position of the body after reaching this point will be shown in the next plate.","[171] LA SERVENTE POI, CHE SI VEDRA ESSERE ANDATA A SERrare la spada di quello, che stà in terza bassa si ritrouaua lei nella terza alta, & è uenuta abbassandosi con una certa proportione secondo che caminaua inanzi, che quando è gionta in misura si è trouata in tanta bassezza che hà aquistata la spada senza fare moto del braccio, & nelo abbassarsi è uenuta portando in dietro la parte destra, & la sinistra inanzi con fare tale contrapeso del corpo sopra li piedi, & ginochii, che hà potuto andare così bassa con grandissima celerità, & hà saputo si bene situare il corpo che se bene il nimico hauesse cauato disopra, lei nan haurebbe cessato dal suo uiaggio senza fare moto di diffesa, perche da quella parte non ui era corpo, in modo che il detto nimico hauesse cauato, ò non cauato, ò fatto quanto li fosse piacciuto, non haurebbe impedito, che questa non fosse andata inanzi unita di spada piedi, & corpo; mà la mutatione, che fà il corpo contra di essa guardia dopò l’ essere gionto à questo segno, si mostrarà nella post seguente figura. 122."
"[21] From the advantage shown in the previous plate with a high tierce has followed the present hit in quarte on the left foot against a low tierce. After winning your position of advantage without extending your arm, you have placed your hilt against the adversary's sword in the position where your point was originally and by running along close to his blade and directing your point into line you have made the hit in quarte, carrying the left foot forward. You would equally have made the hit, if the adversary had disengaged by keeping your hand in tierce; if he had tried to raise his point in order to hit above, by simply raising your hand to quarte you would have made the same hit and passed with equal security.","[172] AL VANTAGGIO VEDVTO NELLA FIGVRA ANTECEDENTE, laquale era discesa dalla terza alta è nata la presente ferita di quarta col piè manco centra una terza bassa, perche quello, che hà ferito essendo peruenuto al detto uantaggio unito, hà, senza slongare il braccio, posto il finimento alla nimica, oue prima haueua situata la spada, & con scorrere per appresso il filo, & dirizare la punta alla presenza hà fatta la detta ferita di quarta passata di piè sinistro inanzi, laquale ferita haurebbe parimenti fatta ancorche l’ auerssario hauesse cauato, restando all’hor con la mano in terza, & quantunque detto auerssario hauesse pure uoluto leuare la punta per ferire la parte superiore, esso ferittore con solamente alzare la mano in quarta haurebbe fatta la medema ferita, & passato con uguale sicurezza, come al presente. 123."
"[22] The third method of attacking the adversary without a pause. The first method which we discussed on this subject of attacking with resolution is good, because you begin to acquire the advantage so far out of distance, that the adversary cannot hit. Yet it appears that the danger is revealed to the adversary too soon, so that he has good opportunity to change his line in order to disorder you, and ample time in which to employ various devices for his protection. The second method also is good, since it forms a secure guard with only one exposed part and that part so near the sword hand that it cannot be reached without passing your forte. With this guard also your sword, as we have shown, is kept so free, that few disengagements are needed. If it were not in other respects so restricted, and you were not under the constraint of keeping your own steady it would be better than the first. Nevertheless considering the imperfections of these two methods, and particularly that defending oneself when the adversary cannot attack is a loss of time and a disadvantage, since it reveals your intentions to him and gives him a chance of finding a remedy, we have sought for another way of proceeding, a third method, which reveals nothing to the adversary until his body is in danger. This method when properly executed, will hit with such swiftness that the adversary not only has no time for so many changes, but can barely parry the first onslaught. The foundation of this method is the certainty that the adversary cannot hit before you are within distance; therefore there is no necessity to defend or to hold your sword steady in any position. You should advance towards the outside, until your feet are within distance; it is of no importance which foot is first. The time to carry the forte to the adversary's faible is when lifting the foot to bring it within distance, in order to exclude his sword without stopping; you should run along his blade in order to hit with your sword, feet and body in union and without rushing; for if he should then break ground he would have time not only to parry but to hit also. By advancing in union you can change in time, as you should do if on the inside when he parries; you should in that case change from tierce to seconde, lower the body and continue your advance when you will hit at the moment of his attempted parry; but in turning from tierce to seconde you must drop your point under his arm, keeping the hand in the same place and bend the body so as to hit in the right side. If your adversary has succeeded in parrying by breaking ground after you have engaged his sword and advanced to hit, he can no longer bring his point into line as for example he could have done, if you had stopped and made an interval between engaging his sword and advancing, for your plan would have been too slow. Similarly if you had [rushed][36] your body or sword forward or hurried your steps, you would have been at a disadvantage, since you could not have turned a second plan, but rather would have been in danger of being hit. You should adopt the same method of advancing with resolution if your adversary on your first approach to engage his sword parries without breaking ground, since before he forced your sword you could hit and pass. But if when making this parry he breaks ground, it is then better to disengage, before he touches your sword; here is the difficulty, because if you move your sword on first seeking his, you cannot disengage in time. Therefore you must advance in such a way that the movement of disengaging shall not be opposite to your other movement; if by accident your hand fell, you could not lift it again in time, if your adversary advanced to meet your sword. But if your point is carried with such ease that you can abandon your first plan and adopt another according to the occasion and with the necessary skill the method will be very deceptive, since, when within distance, you engage your adversary's sword and while he expects to meet and resist your sword you disengage and advance the other foot, so that he can no longer return into line nor do anything but hit below by a half-disengagement; in that case you have only a small movement of the point to make and to lower the body to the line in which his sword is directed; you will continue on your course, exclude his sword and certainly hit. But if the adversary, while you are attacking his sword disengages or advances, rather than breaks ground, he will be hit before he has finished the disengage. If he disengages and breaks ground in order to find your faible again, then you should counter-disengage and advance, when you will hit at the same time; this will be easier and shorter than seeking his sword and disengaging, before he touches your sword. If the adversary changes his guard, when he breaks ground, raising or lowering his point or withdrawing it, in every case you should continue your advance and again seek his sword as soon as you are within distance, but in such a manner that in whatever way he tries to hit, you can keep on your course, parrying and hitting together. From the position and the distance between your adversary and yourself you will understand what he can do in defence and attack, how he can disturn and impede your sword and how to guard against it. For if you do not foresee what may heppen[!], the opportunity passes so quickly that there is no time to form a plan. Of the things that the adversary may do by retreating or withdrawing we do not consider it necessary to treat, because they do no harm, still it is well to know them and be prepared for everything. Those similarly who cut against this method of advancing we can disregard, merely saying that, if your adversary cuts in the time of your advancing to engage his sword, he will be hit before he has half finished his cut. If he cuts while withdrawing you can follow him, covering yourself and proceed to hit; if perhaps you fail to reach and you have parried on the inside in quarte you can change to seconde and hit in the same line, where his sword will be unable to parry; if you have parried on the outside in tierce, again you can change to seconde below and still hit in that line. If you do not wish to parry, you can let the cut pass, and immediately advance, not to hit at that moment, but in the time of his raising his sword or recovering or making another cut. This is better than parrying. An understanding of this third method is better than that of the two first methods; but you must have a good knowledge of distances, and without that you will get no profit from any of the methods we have described, least of all this last method, with which you advance without pause and without holding your weapons in any particular position. In brief you must realise when the foot carries the body into danger in order to secure yourself. When you have well practised this method you will be able to grasp another method, which we shall explain next.","[173] DELLA TERZA REGOLA DI ANDARE A FERIRE IL NIMICO SENZA FERMARSI. LA PRIMA REGOLA DI CVI SI E PARLATO IN MATERIA di questo andare à ferire di risolutione è buona perche comincia à pigliare il uantaggio tanto di lontano, che ’l suo nimico non può ferire, non dimeno pare, che troppo presto si comincii à fare conoscere il proprio pericolo ad’ esso nimico in modo, che se li dà molta comodità di fare mutationi per fare disordinare, & spatio di tempo da usare altri di uersiui per saluarsi: La seconda raggione similmente è buona ancor lei, perche forma una certa guardia, quale non hà se non un solo scoperto, & à quello è così prossima la mano della spada, che nissuno può andare à ferirui senza passare prima per quel forte, tiene anco la detta guardia tanto libera la spada (come si è mostrato) che poche cauationi ui fanno di bisogno di maniera tale, che se non fosse per altro tanto obligata, & che non si conuenisse stare in lei con tanta soggetione, & strettezza di non mouere mai il braccio saria molto migliore [174] della prima. Et però considerando noi l’imperfettione delle dette due prime regole, & particolarmente, che lo diffendersi quando il nimico non può fare offesa non è altro, che un perdi tempo & un riceuere danno, mostrando ad’ esso nimico l’ intentione di quella cosa che si uuol fare, con darli comodità di pigliare rimedio, habbiamo pensato di trouare un modo di operare, & di mostrare una terza regola, con laquale non possa detto nimico conoscere niente, se non quando sia col proprio corpo nel pericolo, & laquale regola, dando l’ osseruattore di essa essequtione à quantò haurà da fare, ferisca con tanta prestezza, che l’istesso nimico non habbia tempo non solamente di tante mutationi, mà quasi à pena di parare il primo effetto. Il fondamento dunque di tale raggione è questo, che si sà certo non potere il nimico ferire prima che non si sia entrato nella misura, & però non occore, che l’ huomo si metta in diffesa, ne che si fermi con la spada in alcuno sito, douendo sempre caminare inanzi uerso la parte di fuori, sino che’l piedi sia intrato in misura non importando più con l’ uno, che con l’ altro, & il tempo di portare il suo forte al debile nimico sarà mentre che si lieua il piede per portarlo in detta misura affine di escluderli la spada di fuori senza fermarsi, & con scorrerli il filo andare à ferire accompagnato di spada, piede, & corpo, & senza slanzarsi, perche se all’ hora il detto nimico rompesse di misura non solo haurebbe tempo di parare mà di ferire ancora; mà con l’ andare unito l’huomo si può mutare in tempo, si come à punto douria fare se si trouasse di dentro, & che’l nimico uolesse parare, perche all’ hora douria mutare di terza in seconda, & abbassare il corpo continouando inanzi, che ferirebbe nel medesimo punto, che l’ istesso nimico hauesse uoluto parare, si bene nel uolgere di terza in seconda dourebbe abbassare la punta disotto del braccio nimico con tenere ferma la mano nel primo sito, & chinando il corpo, che ferirebbe nel destro fianco, perche se bene l’ auerssario hauesse potuto parare col rompere di misura, doppo che se li fosse trouata la spada, & si fosse andato per ferirlo non potria più dirizare la punta in presenza, come per esempio hauria potuto, se l’ huomo si fosse fermato, & hauesse fraposto tempo trà l’ hauere trouata la spada, & l’ essere andato, perche così sarebbe stato troppo tardo l’ effetto, l’ hauere similmente slanzato il corpo, ò la spada, ouero sforzato il passo sarebbe stato dannoso, perche non haurebbe potuto pigliare il secondo partito, & sarebbe stato più tosto in pericolo di essere ferito, che altro; il medesimo modo di passare di risolutione bisogna tenere, se il nimico nel primo andarli à trouare la spada andasse à parare senza rompere ai misura, perche prima che egli hauesse fatta forza contra la spada si potria hauerlo ferito, & essere passato, mà se in questo parrare hauesse rotto di misura sarebbe all’hor stato meglio cauare prima, che esso l’hauesse tocca, & qui stà la difficoltà, perche chi fà moto nel primo andare alla spada non può cauare in tempo, & perciò dee l’ huomo andare in guisa che un moto non sia contrario all’altro nel cauare, che se per accidente la mano facesse una caduta non potria risorgere in tempo se il nimico l’ andasse ad’ in contrare, mà se la punta sarà portata con tale ageuolezza, che l’huomo possa, lasciando il primo effetto, fare l’ altro con forme all’ oportunità, & con quella sottilità, che si richiede, sarà un bello inganno, perche mettendosi il piede in misura si aquista la spada, & mentre che ’l nimico si crede incontrarla & resistere, uede cauarla, & andare con l’ altrò piede in modo che esso non può più ritornare in presenza, ne può fare altro che ferire di sotto con meggia cauatione, & à quello, che uà basta solo mouere un poco la punta con abbassarla insieme col corpo dalla parte, doue uede uenire la nimica, & seguire il suo corso, che terà detta nimica esclusa di fuori, & andarà di certo à ferire, mà se’l nimico, mentre che si uà alla sua spada cauarà, ò uorà uenire inanzi, se non romperà di misura restarà ferito prima, che sia finita la cauatione, & se nel cauare, esso romperà di misura per andare à ritrouare il debile all’ hora l’ osseruattore di questa regola dourà contra cauare, & andare inanzi, che ferirà in tempo medesimo, & questo sarà più facile, & più breue, che andare alla spada, & poi uolere cauare prima che ’l nimico la tocchi; & se per auentura il detto nimico mutasse guardia nel rompere di misura alzando, ouero abbassandola spada, ouero ritirandola, si dourebbe in ogni caso [175] continouare inanzi, & tornare à mettere la spada alla nimica nel tempo che ’l piede torna ad’ aquistare la misura mà in tale maniera però, che se detto nimico uolesse ferire, come che più à lui piacesse, si potesse sempre seguire il suo uiaggio parando, & ferendo insieme, & dal sito, & distanza frà il nimico, & se stesso nel andarlo à trouare dourà l’ huomo conoscere quello, che esso nimico possi fare per diffesa, & offesa, & come possi turbare, & impedire la spada per sapersene guardare, perche chi non antiuede quello, che può accadere l’ occasione è tanto ueloce à passare, che non resta tempo da potere pigliare partito. Di quelle cose poi, che l’ huomo fà fuggendo, & dillongandosi non giudichiamo neccessario lo trattarne, perche non offendono, se l’ huomo non uuole, pure è buono à saperle, & stare prouisto à tutte le cose. Di quelli similmente, che tiranno di taglio contra questa raggione si potria fare dimeno di trattarne pure diremo, che se uno tirrarà nel tempo che’l nostro osseruattore andarà all’ aquisto della spada, che restarà ferito prima che sia finito meggio il taglio, & se lo tirarà fuggendo potrà il nostro seguittarlo coprendosi, & andarlo à ferire, & non ariuandolo, forsi, & che il parato sia stato di dentro di quarta, potrà uoltare in seconda, che ferirà nel luogo medesimo, doue la nimica non potrà parare, se ’l parato anco sarà stato di fuori di terza, potrà uoltare pure di seconda di sotto che non meno ferirà in quella parte, &, non uolendo parare, potrà anco lasciare passare il taglio, & subbito andare inanzi non per ferirlo in quel punto, mà per ferirlo nel tempo, che rileuarà la spada, ò si rimetterà, ouero tirarà un’ altro taglio, & questo sarà più à proposito che ’l parare, & il sapere operare in questa guisa è anco migliore delle due prime, mà si richiede sapere conoscere ben le distanze, perche, non conoscendole, non si cauaria profitto d’ alcuna dette descritte raggioni, & tanto meno di questa, netta quale si uà senza fermarsi, & senza tenere sito fermo dette armi, si dee in somma sapere conoscere quando il piede porta il corpo nel pericolo per potersi assicurare, nellaquale regola, quando l’ huomo haurà fatto buona pratica dourà poi tenere altro modo, como noi mostraremo nell’ altra seguente regola."
"[23] Here you will see a tierce on the left foot, which has acquired the control of the opponent's sword on the outside, the opponent also being in tierce. With this advantage with the same guard you will continue right to the adversary's body. You will succeed because you have approached within distance without forming a guard, and when your foot came within danger you have covered yourself from your adversary's sword without touching it; you will advance without pause right to his body, taking a time according to the opportunity; if he offers no time you will follow along his sword, and continue as you have begun, preserving your union.","HORA SI VEDRA APARIRE QVI OLTRE VNA TERZA SOPRA il piè manco, che hà aquistata la nimica dalla parte di fuori, laquale nimica ancor lei era in terza, & per tale uantaggio seguitarà della stessa guardia sino al corpo auerso, & tutto succederà perche quello,che hà trouata la nimica è andato sino alla distanza senza guardia, & mentre, che col piede è intrato nel pericolo si è coperto dalla detta nimica senza toccarla, & andarà sino all’ auerssario senza fermarsi pigliando li tempo secondo l’ occasione datali dal detto nimico, che se ciò non faccesse seguitaria per la spada & andarìa come hà cominciato tutto unito. 124."
"[24] From the advantage won over the adversary's sword, as shown in the preceeding[!] discourse, has followed this hit in quarte against another quarte. Seeing you advancing in order to control his sword, the adversary has taken that time and disengaged in quarte, turning his body with the left foot, in order to hit you in the chest; but you have advanced in union and with little movement of the sword and by merely changing your hand from tierce to quarte and continuing your advance, you have hit him in the throat in the same time; also you have driven his sword out of line, because the position of your sword was stronger, and because of the weakness of his position in turning his body and because your arm is stronger than it would be if extended.","[176] DA QVEL VANTAGGIO PRESO DI FVORI DELLA SPADA NImica, come si è mostrato nell’ antecedente discorso è nata questa ferita, che si uede seguire di quarta contra un’ altra quarta, perche collui che e ferito uedendosi uenire contra l’ auerssario per impatronirsi della sua spada hà pigliato quel tempo, & cauato di quarta girando il corpo col piè sinistro per ferirlo nel petto in quello uenire, mà il ferittore, che era andato alla nimica unito, & con poco moto della spada, uoltando solamente la mano di terza in quarta, & continouando inanzi hà ferito lui in tempo medesimo nella gola, & hà fatto uscire la detta nimica di linea perche è stato più forte nel termine della spada, & anco per la debolezza, che è nel sito di quello che gira il corpo, & di più, perche anco il sito del braccio di collui, che ferisce è più galiardo, che se fosse disteso inanzi. 125."
