"[18] This plate illustrates a guard in tierce at an angle, although there is much uncovered above the sword, yet the dagger defends that part; therefore the dagger is held erect and high, with the hand somewhat low and to the outside, so that the adversary can hit only in that part which is exposed above the sword. The intention is to parry with the dagger held thus high and to hit in tierce under the adversary's sword, with the same angle. This stroke is very difficult to parry for it cannot be thrust downwards because of the angle which pushes away the dagger, resists and goes to the body. Therefore the adversary must push your sword to the one side or the other according to which side it is nearer; or rather he must push the sword to that side where it will be out of line in the shortest time, and where it has less force and can offer less resistance. With this guard excellent strokes can be made under the dagger on the outside, and also between the weapons. Sometimes you must lower the point a little and make the angle again hitting with the force of the angle, so that even with both his weapons, the adversary can not[!] push your sword down. You will succeed because his weapons will glance towards the strength of the angle, that is the hilt of your sword. Therefore the adversary has to use much judgment in deciding to which side to push your sword, in order to defend himself more easily; otherwise he must save himself by retiring. That plan of retiring should be adopted, since the thrust at an angle does not reach very far. The best rule then is not to parry.","LA SEGVENTE FIGVRA RAPRESENTARA VNA TERZA ANGOlata, laquale ancora, che sia molto scoperta sopra la spada là non dimeno la diffesa del pugnale, & lo tiene così erretto in alto, & la mano alquanto bassa & in fuori, acciò che l’ auerssario non possa ferire altroue, che in quello scoperto sopra la spada con in tentione di parare di detto pugnale così alzato come si troua, & ferire di terza sotto la nimica col medesimo angolo, laquale botta è assai difficile, da parare non potendosi spingerla à basso per caggione di quello angolo, che uiolenta il pugnale, resiste, & uà al corpo, però è neccessario il spingerla ò per l’ una, ò per l’ altra parte secondo, che sarà uenuta più prossima ad’ uno che ad un’ altro luogo, se ben si douria spingere la spada da quella parte, doue con più breue tempo essa può uscire di uista, & doue hà minor forza, acciòche più presto [95] esca, & senza fare resistenza. Con questa guardia si fanno assai buoni colpi sotto il pugnale perla parte esteriore, & anco nel meggio dell’ armi, dee si taluolta abbassare un poco la pùnta & reangolarla in sù ferendo con la forza dell’ angolo, talmente, che se il nimico ui mettesse anco tutte due le armi per rispingerla abbasso non potesse fare niente, il che riusciria perche dette armi nimiche scorreriano nel forte dell’ angolo detto di sopra ciò è nel finimento della spada, in modo che detto nimico haura bisogno di molto giuditio per conoscere da qual parte hauesse da rispingere detta spada per più facilmente diffendersi, altrimenti conueria saluarsi con qualche ritirata di uita, & tanto più si appi gliarebbe à si fatto partito, quanto, che l’ angolo non ferisse molto lontano, & la migliore regola saria di non parare. 59."
"[19] This is a guard in tierce with the sword and dagger. It is formed with the points of the weapons in conjunction, so that the adversary cannot hit between them. The sword should be held with one fifth of its length beyond the dagger in order to prevent the adversary from harassing the dagger by disengagements and feints. As the sword is so far advanced, the forte of the sword can be very well used in the defence, with the support of the dagger. There is the further advantage that the point of the sword is nearer the adversary's body, and, if kept free, is ready to hit with a lunge or a pass. You can wait or attack at pleasure, make feints, disengagements, counter-disengagements, times, or counter-times; you can lunge or pass, above or below the dagger, in any part according to your opportunity, and with little change of the hand, since it is between seconde and quarte.","VNA TERZA GVARDIA DI SPADA, E PVGNALE SARA QVELla, che segue, laquale si dee formare con le punte così accompagnate, come si uede, acciò il nimico non possa ferire nel meggio dell’ armi, & si dee tenere la spada auanzata un quinto di essa spada inanzi il pugnale per impedire al detto nimico il poterlo trauagliare con le cauatione, & con le finte, & essendo poi la spada così auanzata si potrà adoprare molto bene il forte di esso per diffessa, & agiuto de lo stesso pugnale, oltre l’hauere il benefficio punta più uicina al corpo nimico, la quale, conseruata libera, sarà molto pronta à ferire, tanto à piè fermo, come passando, potendo aspettare, & assalire segondo, il [96] beneplacitto, & si potranno fare finte, cauationi, contracauationi, tempi, contratempi ottimamente potendosi ferire à piè fermo, & passando disopra, & disotto del pugnale, & in qualunque parte secondo l’ occasione, & con poca mutatione della mano, per essere posta nel meggio della seconda, & della quarta. 60."
"[20] This is a guard in tierce, with the sword advanced, the dagger near the hilt, the right side forward and the left exposed. With this guard you may advance gradually within distance, in order to entice your adversary to hit at the part uncovered and to defeat him at the moment of his advance with a tierce or quarte; the quarte would be better, because your weapons would be closer together so that he could not hit below, whilst defending above. When you are approaching within distance if your adversary changes the position of his dagger, with this guard you can make a swift thrust, which would hit under the line of the dagger on the inside and close to the sword; or you might make an excellent stroke over the sword in the straight line. In this position the dagger cannot be much harassed by the adversary's sword, for too much judgment and circumspection would be needed to bring the sword so far forward. In using this guard you should know how to preserve your sword from being engaged by the adversary's weapons, when you would have difficulty in freeing it and could only do so by withdrawing it, which would be bad. Also you must keep within wide distance, so that your adversary cannot pass. With this guard it is sometimes advantageous to change to quarte.","QVEST’ ALTRA SARA VNA TERZA PVRE CON LA SPADA auanzata, & col pugnale presso al finimento, portando la destra parte inanzi, & tenendo la sinistra scoperta, & laquale si uà pianpiano approssimando alla misura per tirare il nimico à ferire in quello scoperto, & batterlo nel proprio punto, che uiene di terza, ò di quarta, laquale quarta sarebbe migliore perche l’ huomo restarebbe più accompagnato con le armi affine che ’l nimico non potesse ferire disotto, nel tempo che diffende la parte disopra, & quando nelo auicinarsi nelle distanze il pugnale nimico suariasse, si potria con questa guardia slanzare dentro la botta con prestezza, che andaria benissimo à ferire sotto la linea di esso pugnale & di dentro uicino alla spada, & anco sopra la spada si potria fare un buon effetto de retta linea; oltre che stando in questa forma il pugnale non può essere molto trauagliato dalla spada nimica, perche troppo giuditio, & troppa circonspetione bisognarebbe à chi si uolesse condure tanto inanzi, è uolendo usare questa guardia basta solamente il sapere ben guardare la spada dalle armi nimiche, acciò che non li uenga occupata, & essere poi in difficolta di liberarla, che non si potria fare se non ritirandola, il che sarebhe [97] mal fatto, & si ha da conseruarsi in lontana distanza acciò il nimico non possa passare. Si auertisse ancora, che in tale guardia uiene tal uolta à proposito il girare in quarta. 61."
"[21] Here follows another tierce with the dagger advanced and the sword as much withdrawn, in order to keep it free from the adversary's weapons and to give more impetus to the lungs[!]. The sword does not impede the dagger in seeking the adversary's point, and the whole defence is based on the dagger. It is considered that the distance from your dagger to your body is so great, that the adversary's sword cannot penetrate so far, before you have had a chance to parry. This would be true, if he had begun to hit before the point of his sword penetrated your dagger. But against an opponent who knew how to carry his sword forward, so that its point began to penetrate your dagger hand, and knew how to form his decision according to the opportunity, you would be deceived in your judgment, especially if your opponent decided not to advance his sword; to meet that case you must hold your sword advanced and bring the point close to the dagger hand; but promptness is required lest your adversary should engage your sword, and in order that you may take advantage of his movements. This guard is better used in practice, in order to learn the use of the dagger, rather than for anything else. In actual fighting another position and a different style would be required.","SEGVITA PARIMENTI VNA TERZA, LAQVALE HA IL PVGNAle molto auanzato, & la spada altretanto ritirata, & questo per tenere la detta spada più libera dalle armi nimiche, & per scaricare la botta con maggiore impeto, & perche la non impedisca il pugnale nel seguire la nimica con fondare tutte le sue diffese sopra esso pugnale, giudicando, che la distanza dal detto pugnale al proprio corpo sia tanto longa, che la nimica non possa penetrare così inanzi prima, che non si habbia hauuta gran comodità di parare, come sarebbe uero, se si cominciasse à ferire prima, che la punta della spada penetrasse esso pugnale, mà hauendo à fare con chi sapesse portare la spada tanto oltre, che la sua punta cominciasse à penetrare la mano del detto pugnale, & conchi si sapesse risoluere secondo l’occasione restarebbe ingannato delle sue raggioni, & massime se esso non si risoluesse di auanzare la spada contra laquale à uolere contendere bisogna tenere la spada auanzata, & mettere la punta uicino alla mano del detto pugnale, mà ui uuole prontezza, & perche l’auerssario non la troui, & per potere pigliare l’occasione de suoi moti; si bene questa guardia è più tosto buona per essercittarsi, & fare buon pugnale, per così dire, che altro, perche nel combattere da douero si ricercarebbe altro sito, & altro stile. 62."
"[22] Here follows another tierce formed on the left foot, with the body bent, the sword hand opposite the left thigh and the dagger extended and so high, that the head is almost entirely hidden beneath the line of the left arm. All these positions are to facilitate the defence with the dagger and for the greater security of the body, which is seen to be bent so as to shorten the line of the left side and so that it may be defended with less movement. With this guard the head is low, so that in parrying below there is less exposed above. The hilt of the sword is kept near the knee in order that you may use the forte in defence and be better able to hit. The dagger cannot be much harassed. With this guard you can close distance, or wait and give your adversary various opportunities by movements of the body and weapons. When your opportunity to hit comes, it is better to pass than to lunge.","[98] MA QVI OLTRE SI VEDRA APPARIRE VN’ ALTRA TERZA FORmata sopra del sinistro piede, laquale tiene il corpo curuato, & la mano della spada inanzi alla sinistra coscia col pugnale steso, & alto in modo, che ’l capo uiene quasi tutto alcosto sotto la linea del sinistro braccio, lequale cose tutte sono fatte per facilittare la diffesa al pugnale, & per maggiore sicurezza del corpo, ilquale si uede piegare per abreuiare la linea del sinistro fianco, & per diffenderlo con minor moto. Tiene questa, guardia il capo basso, acciò nel parare di sotto, resti meno scoperto di sopra, adopra la spada col finimento inanzi il ginochio per potersi ualere del forte in caso di diffesa & per potere anco meglio ferire, ne il pugnale può esserle tanto trauagliato, & nellaquale guardia l’huomo può serrare la misura, & può anco aspettare, & dare diuerse occasioni al nimico, con atti di corpo, & mouimenti di armi, mà uenendo oportunità di ferire meglio è passare, che ferire à pie fermo. 63."
"[23] Here is another tierce with the right foot carried outwards, the knee bent and the body supported on that knee. The sword hand is advanced towards the adversary a distance equal to the length from the elbow to the hand, and the sword is inclined upwards at an angle in order to be in conjunction with the dagger, which is held high and in a straight line from the shoulder to it's[!] point. In approaching the adversary the left foot is brought up to the right, and the right foot carried in a circle towards his left side. That part of the side which is seen to be uncovered below the dagger is always kept back, so that if the adversary tried to hit it, you vould[!] parry with the forte of the sword, which is held forward. You should pass with the left foot, turning the hand into quarte and always keeping the dagger steady with the intention of defending, the upper parts; the body too should be kept at the same height. If you do not wish to pass or cannot pass because you are in motion, you can still parry and hit in the same manner by carrying the right foot into the straight line and without moving the dagger, so that your adversary cannot make a feint below and hit above, or vice versa, and from whichever side he comes you are defended. If he disengages over your sword, your dagger, which is steady, can easily parry and defend. If he tries to engage your sword with his dagger, then you can hit under the arm or over the dagger, by advancing in a circle towards that part in order to withdraw out of his line and to hit better; even if your adversary closed the distance he would effect nothing. With this guard, if the points of your adversary's weapons are separated, you may make some very good strokes in between as oppotunity[!] offers, if they are close together you can harass his dagger. But with this guard you should never change your hand, lower your point much, make appels nor stand still, but you should approach in a circle, keeping the same front as you gradually approach, and form your decision with swiftness. Sometimes you will parry with the forte of the sword, glide your dagger along the adversary's blade letting it remain there and hit with great force. This guard is sufficiently good, though laborious; but its limitations should be realised.","[99] SEGVITTARA PVRE ANCO VNA TERZA, LAQVALE STA COL destro piede trauersato, & col ginochio piegato sostenendo il corpo tutto sopra esso ginochio, & la mano della spada inanzi, tanto uerso il nimico quanto è longo il braccio dal combito sino alla mano, tiene la spada angolata à lo insù per conggiongersi col pugnale, ilquale stà così alto, che dalla spalla alla punta fà una retta linea, & ne lo auicinarsi al nimico uà aggiongendo il sinistro al destro piede, portando detto destro in giro uerso le parti sinistre dell’ auerssario con stringere sempre la misura, & con sempre tenere lontana quella parte del fianco sotto il pugnale, laquale si uede scoperta, affine che se esso auessario andasse per ferire in detta parte potesse parare con quel forte della spada, che si uede inanzi & passare col sinistro piede uoltando la mano in quarta, & tenendo sempre fermo il pugnale con intentione, che ’l non habbia se non ha diffendere la parte disopra; resta sempre col corpo nella medesima bassezza & non udendo, ò non potendo passare per trouarsi in moto de’ piedi; para con tutto ciò, & ferisce nel medesimo modo con portare sempre quel destro piede trauersato in retta linea, ne mai moue il pugnale, in modo, che non seli può fingere disotto per dare disopra, ne di sopra per dare disotto, mà uenendo il nimico da qualunque lato si diffende andando à ferire in una medesima forma, & chi uolesse cauare sopra la spada quando essa guardia uà à parare il pugnalo che è fermo facilmente diffenderebbe, & chi uenisse per aquistarli la spada col pugnale [100] all’hora lei ferirebbe sotto il braccio ouero di sopra di esso pugnale con auanzarsi pure in giro uerso quella parte affine di allontanarsi dalla uista nimica, & per potere meglio ferire, & perche anco se il nimico si auicinasse alle distanze non facesse niente. In questa guardia se si trouano le punte delle armi aperte si fanno assai buoni[25] colpi nel meggio con diuerse occasioni, & se serrate si trauaglia il pugnale, mà non si dee, mai uoltare la mano, ne abbassare molto la punta, ne si dee condetta guardia fare chiamate ne stare fermo, mà si hà da auicinarsi sempre in giro, in modo che si resti in una istessa presenza di corpo con andare pian piano nelo auicinarsi, & risoluersi con celerità, & alcune uolte parera col forte della spada, & scorrera col pugnale, lasciandolo alla nimica, & andera con gran forza à ferire, laquale guardia è assai buona, se bene laboriosa, mà è neccessario conoscere li termini. 64."
"[24] This plate is also of a tierce but little practiced, though known by some. It is formed with the feet together, the body bent, the weapons divided, the dagger and sword both high. The sword is held high so that it cannot be engaged, the dagger high and withdrawn so that it cannot be harassed, the weapons divided so that the adversary can hit only between them, and the feet together to form a centre with the adversary on the circumference; at the centre you can change your front by a small movement more than your adversary on the circumference can by two steps. Moreover with the feet close together you can make a step forward and obtain a long reach, so that with this guard you get within distance before your adversary by an amount equal to the distance between his feet. Although you are within distance, your sword cannot be reached and you will easily keep it free. Being within distance, if you wish to pass with the left foot, your dagger will reach the hilt of your adversary’s sword, and your body will be turned and go out of line and you will be so far advanced that your adversary cannot free his sword. If with this guard you advance with the right foot, your sword will reach his hilt before he is within distance, and you can protect yourself on any side by getting out of presence. The power to reach where your adversary cannot reach is a great advantage, coupled with the fact that he cannot engage your sword until he is within close distance. Therefore if your adversary remains steady within presence, he will be in great danger of being hit for the sword falls downwards with greater speed than that with which it can be raised upward, as happens with all heavy objects. When the sword is held high in this manner, before it arrives in line it penetrates so far that it forces away the adversary's weapons, and the hit is almost inevitable because of the distance the sword has penetrated and because very great strength is needed to resist and check its weight, and also because it is unexpected, since the adversary, who is not within distance, is deceived in supposing that you also cannot reach. With this guard also you can hit in every part, even between the weapons, with or without a pass after hitting you can recover at once, but somewhat in a circle. In meeting this guard you must consider that your adversary's sword has to fall, and that in approaching you must close its path, so that it cannot reach the body; you must begin at a distance, so that your adversary is not within distance even if he advances his foot. You must hold your sword at the same height, so that approaching your adversary's sword your point is near his without your having to move either inside or outside. You should advance by natural steps and with the dagger in conjunction with the sword for greater safety, and you should move your feet and body towards his right side, in order to arrive more quickly within his point and reach his body. In case your adversary on your advance makes any small movement to change his front, you should then seize that oppotunity[!] and advancing your feet and body towards his left side hit with a guard of quarte, holding the dagger high in order not to neglect the defence, although your adversary cannot hit as he has turned both his feet and changed his front, so that his sword has made a movement opposite to that needed for a hit. But your greatest danger is that your adversary, who has his feet together, may carry back his right foot and leave his dagger for the defence in such a way, that his body will be turned out of line and his sword so far withdrawn, that he can return it even if you have reached his body; but if in that case you left his sword aban-doning your first line and in the same time passed behind his left side, with your head outside his dagger arm; in this way you would save yourself.","LA FIGVRA, CHE SEGVE E NON MENO VNA TERZA ANcor lei mà poco essercittata, se ben conosciuta da qualch’ uno, laquale si forma co’i piedi gionti col corpo curuato, & con l’ armi aperte, col pugnale alto cos ì bene come la spada, laquale spada si tiene alta acciò il nimico non la possa hauere, & il detto pugnale così alto, & anco ritirato, acciò non possa essere trauagliato dalla spada nimica, mà lo stare con l’ armi aperte è perche il detto nimico non habbia se non quel meggio da ferire, & li piedi gionti non per altro, se non perche uuole formare, come, un centro di se stesso, & che ’l nimico sia la circonferenza, ilquale centro uolta più la prospettiua con un picciolo moto, come si sà, che [101] non fà la circonferenza con dui passi oltre, che essendo co’i piedi così gionti può portare il passo assai inanzi, & ariuare molto lontano, in modo, che detta guardia aquista la misura prima del suo auerssario tanto quanto è longo quel termine, che è fra l’uno, & l’altro piede del detto auerssario & se bene l’huomo in tal guardia si trouarà nella misura non li potrà essere ariuata la spada dal nimico, in modo che esso la terà facilmente libera, & essendo pure nella misura, se uorà passare col sinistro piede ariuarà col suo pugnale al finimento della nimica, & quel corpo, che horasi uede si uolgerà, & anderà fuori di presenza, & per essere ariuato tanto inanzi il nimico non potrà liberare la spada, mà se l’ osseruattore della guardia si portara col destro piede la sua spada ariuarà quasi sino all’ else, che l’ altro non sarà gionto nella sua misura, & con potere uscire di presenza, & saluarsi da qualunque parte, in modo, che è un uantaggio molto grande il potere ariuare, doue non può il nimico, certifficato che quello non possa mai hauere la spada, che prima non sia nella misura, stretta & perciò tutti colloro, che andaranno à fermarsi in presenza portaranno gran pericolo di restare feriti, perche con maggiore prestezza cade la spada di alto à basso che non si lieua di basso in alto, si come auiene di tutte le cose ponderose, & essendo in quello modo alta inanzi, che sia ariuata in presenza penetra tanto, che uiolenta l’ armi, & fere quasi irreparabilmente si per essere già penetrata, come perche troppo maggior forza ui uuole à resistere, & ritenere la cosa graue, ne meno per giongere inaspettata, perche collui, che non è in misura s’ inganna credendo che l’ altro uisia ne anco lui ne, che possa ariuare. Questa guardia in oltre ferisce da tutte due le parti, & anco nel meggio dell’ armi, & tanto passando, quanto non passando, & dopò ferito può anco subbito rihauersi, & rimettersì, se bene con girare alquanto. Et per tanto colloro che uoranno andare contra tale guardia douranno molto ben considerare, che quella spada hà da cadere, & che uolendo auicinarsi fà di mestieri chiuderli la uia, che non possa uenire al corpo, douendosi cominciare di lontano, in modo che il nimico non solo non habbia la misura, mà che non la possa hauere ancorche auanzasce il piede, & però si dee tenere la spada nella medesima altezza inguisa che giongendo alla punta nimica l’ una sia uicina all’ altra senza che s’habbia da mouere ne indentro ne in fuori, & si conuiene andare contra tale guardia di passi naturali col pugnale sempre accompagnato alla spada per sicurezza maggiore, & con cacciarsi còi piedi, & col corpo uerso la destra parte dell’ auerssario per ariuare più presto dentro la punta & andare fino al corpo nimico, & se per caso il detto auerssario nell’ andarli contra facesse qualche poco di moto per uoltare la presenza si douria all’ hora pigliare quella occasione, & andare col piede, & col corpo uerso le sinistre parti nimiche ferendo di quarta guardia, & tenendo alto il pugnale per non abbandonare la diffesa con tutto che’l nimico non potesse ferire per hauere girate tutte due le punte de’ piedi, & uoltata la prospettiua, nel quale caso la sua spada hauria fatto effetto contrario di quello bisognarebbe à uolere ferire, mà il maggiore pericolo di quello, che uà è che trouandosi cosi conggionto co’i piedi può il deto auerssario portare indietro il destro, & lasciare il pugnale alla diffesa, in mono che’l corpo ueria à uoltare fuori di presenza, & la spada à ritirarsi tanto, che questo la potrebbe rimettere, ancora che si fosse gionto al corpo, quando non si hauesso lasciata del tutto la nimica, abbandonando la prima linea, & nel medesimo tempo essere passato sino di dietro del sinistro fianco nimico, & col capo fuori del braccio del nimico pugnale, che in tal modo si sarebbe saluato. 65."
