Draft Translation (from the archetype) (ca. 1900) by A. F. Johnson (transcribed by Michael Chidester),Archetype (1606) [edit] Transcribed by Michael Chidester
"[1] Second part. Discourse on the principles of the sword and dagger. As we consider that we have treated at sufficient length of the practice and times of the sword alone, it has seemed to us suitable, in order to give full satisfaction to the reader, to introduce here the instructions and rules of the sword and dagger. We do not mean to prefer this method of arms to that of the sword alone, nor to multiply different precepts, nor to throw over the instructions given by us elsewhere. It is rather our purpose to show the wealth and abundance of the practice of this art, which by uniting several arms together becomes more admirable and perfect. Therefore without neglecting the subtleties of the times of the sword alone, or denying them in any way, for they are beyond comparison the more artful, we shall now leave them, having put them forward and analysed them in their place, and shall proceed to describe, as far as is necessary, the perfect use of the sword and dagger, and to impart the true knowledge of the stratagems useful in the attack and the defence, and dangerous to those inexperienced in the art. One who is well acquainted with the times, will easily find great benefit. These two arms are allies of one another, and by their union give great strength in need; also they divide and share the functions, the one defending and the other attacking. We hope those who practise with these arms, following the present instructions, will reach the perfection they desire.","[76] PARTE SECONDA. DISCORSO SOPRA LE RAGGIONI, Di spada, è pugnale. HAVENDO NOI PER QVELLO, CHE CREDIAMO, TRATtato assai pienamente della pratica, & tempi di spada sola, ciè parso assai conueneuole perdare ìntiera sattisfatione à chiunque leggerà, di porre in questo luogo li auertimenti, & regole di spada, è pugnale, non con animo di preferire questo modo di armeggiare à quello della sola spada, ne meno per moltiplicare in diuersi precetti, partendoci da quei ricordi altre uolte da noi insegnati, mà più tosto per mostrare la richezza, & copia dell’ uso di quest’ arte, laquale potendo conggiongere più armi insieme, uiene à rendersi, & più amirabile, & più perfetta, & però non dillongadoci dalle sottilità dè tempi di spada sola, ne à quelli in nessun modo contradicendo, come più artifficiosi senza comparatone, li passaremo con silentio hauendoli proposti, & risoluti à suoi luoghi, mà procederemo à dichiarare, per quanto è neccessario, la perfetta operatione di spada, e pugnale, & ad’ insegnare la uera cognitione de’ stratta- [77] gemi, utili per offendere, & diffendere, & dannosi all’ inesperti dell’ arte. Et però chi sarà bene intendente de’ tempi facilmente ne configuirà frutto grandissimo, perche essendo queste due armi una a giutante dell’ altra, & che insieme unite fortifficano assai secondo il bisogno, ne meno ancora, perche di uidendosi frà loro compartono l’ operationi una in diffendendo, & l’ altra in offendendo, speramo, che quelli, i quali in ciò s’ essercittaranno osseruando li presenti amaestramenti, ariuaranno alla perfetione, che desiderano."
"[2] The positions of the sword and dagger. The positions of the sword and dagger are formed with the body bent and the feet close together, and with the weight of the body on the foot which is to remain steady. The arm holding the dagger should be extended as high as the point of the shoulder, with the point of the dagger inclined upwards and directed towards the adversary. The sword should be so far advanced as to extend beyond the dagger by at least one fifth of the sword's length, so as not to be impeded by the movements and feints of the adversary. With this guard you can make better use of the forte of the sword in any event. The sword and the dagger should be in conjunction so as to close the path between them against the adversary. If you wish to use the sword in an advanced position, the dagger should be held in conjunction with the hilt of the sword, so as to close the path to the adversary. Similarly the right side should be kept forward and the left back, as the latter is more exposed and in greater danger.","DELLE POSTVRE DI, Spada è pugnale. LE POSTVRE DI SPADA, E PVGNALE SI FORMANO COL corpo curuato in picciolo passo, & col peso del corpo sopra quel piede, che deue stare fermo, & anco col braccio del pugnale disteso infanta altezza quanta è la punta della spalla, & con la punta del pugnale erretta che guardi uerso la nimica, & con la spada tanto auanzata, che sia più inanzi del pugnale almeno per un quinto della longhezza di essa spada, perche non possa essere tanto trauagliato dalli mouimenti, & finte del nimico, & l’ huomo in tale guardia potrà meglio ualersi del forte diessa in ogni euento, ilquale dourà tenere conggionti la spada, & il pugnale per chiudere la uia nel meggio al nimico di ferire; Mà chi uorà usare la spada auanzata dourà tenere il pugnale conggionto con la guarnitione di essa, che così chiuderà il luogo da ferire al detto nimico & similmente dourà tenere il destro fianco inanzi, & il sinistro indietro, per essere questi più scoperto, & di maggiore pericolo."
"[3] The counter-positions. The counter-positions are more difficult to form, since you must attend to your own two weapons and the two of your adversary and their positions. You must be careful not to advance so far in the desire to acquire some advantage, that your adversary can engage your sword with his dagger and hit. Therefore you must keep the sword so far distant that you know you can save and move it before it is engaged by his dagger. For the rest you should observe the same conditions and principles which we explained in describing the counter-positions of the sword alone, taking care that your body is clear of the adversary's sword without movement of the body or weapons, and that your weapons are in conjunction to give greater strength and surer defence.","DELLE CONTRAPOSTVRE. PIV DIFFICILI DA FORMARE SONO LE CONTRAPOSTVre perche bisogna attendere alle due armi proprie, & alle due del nimico, & posture di esse, che perciò si deue essere, auertito di non portarsi tanto oltre uolendo aquistare qualche uantaggio che ’l nimico possa guadagnare la spada col suo pugnale, & ferire di modo che si hà da tenere la spada tanto lontana da quello, che si conosca poterla saluare, & muouere prima che sia occupata dal pugnale di esso nimico; Nel resto si douranno osseruare le medesime circonstanze, & raggioni mostrate in descriuere le contraposture di spada sola, con auèrtire che ’l corpo sia libero dalla punta della nimica senza moto di corpo, ne d’ armi, & che le dette armi siano conggionte per maggiore fortezza, & diffesa."
