Draft Translation (from the archetype) (ca. 1900) by A. F. Johnson (transcribed by Michael Chidester),Archetype (1606) [edit] Transcribed by Michael Chidester
"[1] General discourse of the first book. The principles of the sword alone. In opening our promised work we shall begin with the sword alone, for on the knowledge of the sword depend the principles of all other arms. Many rules will be given which may serve excellently for the sword accompanied by the dagger or any other arm. He who can use the sword alone well will easily learn to use it in conjunction with other arms. You must know then that the rules of the sword are founded on four guards in which are formed all the positions and counter positions. From them arise the times, counter-times, disengagements, counter-disengagements, double disengagements, half disengagements, and re-engagements; nor in short can anything be done in attack or defence which does not partake of the nature of one of these four guards. They are differently formed, as will be seen in the accompanying plates. These we have introduced in order that you may recognise with what variations of position of the sword, feet and body, they are made. We shall describe the nature of each guard in its place and the plates will show the results which may arise from them. The discourses will be such that you will easily see when to apply the various rules, and how to the best advantage you must approach your adversary in order to come within presence. Though one who understands the art may approach as he pleases, since in whatever position he is he will succeed by his knowledge of distances, weak and strong positions, exposed and unexposed parts. Nevertheless it is certain that one position is better than another, and a man may approach with more security when he parries his arms in the proper manner. When within distance he must proceed in various ways, according to the changes made and the opportunities offered by his adversary, and according to the distance in which he finds himself. The distances are two, and what is good in the one is not so in the other. These distances control the whole attack and defence, as we shall explain. First we shall describe the four principal guards, why they are called, prime, seconde, tierce and quarte, and the origin of these names. Then we shall treat of the divisions of the sword, then of counterpositions, distances, and some other matters which we consider necessary and useful to the good student of this art.","[1] DISCORSO GENERALE DEL PRIMO LIBRO Sopra li fondamenti detta spada sola. Cap. 1. DOUENDO NOI DARE PRINCIPIO ALL’ OPERA promessa cominciaremo dalla spada sola come quella, dalla cognitione della quale dependono anco li fondamenti di tutte l’altre armi, & percio s’intenderanno molte raggioni, lequali potranno ottimamente seruire, ancorche sia accompagnata dal pugnale, ouero altra arma, & chi saprà bene oprare quella fola facilmẽte impararà di oprarla non meno accompagnata. Per tanto si dee sapere, che le raggio ni di essa hanno il suo fondamẽto sopra quattro guardie, con che si formano tutte le posture, & contra posture, & da esse nascono li tempi, & contratempi, cauationi, contracauationi, ricauationi meggie cauationi, & comettere di spada, ne si può in somma fare cosa alcuna per diffesa, ouero per offesa, che non si faccia con la natura di una di dette quattro, lequali uengono formate diuersamente, come si uedrà per le seguenti figure, poste da noi, acciò si conosca con quanta uarietà di siti, e prospettiue di spada, di piedi, & di corpo si facciano, & à suoi luoghi si discorrerà sopra la natura di ciascuna, & si metteranno anco in pittura li effetti, che da loro possono nascere, & i discorsi saranno tali, che ageuolmente si potrà comprendere, quando sia tempo ualersi hor dell’una hor dell’ altra raggione, & conche modo per maggiore uantaggio si debba andare contra il nimico per fermarsi in presenza, ancorche da uno che habbia scienza si possa andare come li piaccia, perche trouandosi in qualũque sito farà nascere buono effetto per la cognitione delle misure, debili, e forti, coperti, & scoperti, Nondimeno ècosa certa,che un sito è migliore dell’ altro, & più srcuramẽte Può l’huomo auicinarsi nelle distanze, quando, ché porta l’armi in debbito modo, doue poi gionto, hà da operare diuersamente, secondo le mutationi & opurtunità date dall’ auerssario, & secondo le distanze, inche si trouarà, lequali sono due, & quello, che è buono nell’ una non uale nell’ altra, & lequali distanze sono patrone di tutte le offese, & diffese, come si mostrarà, doppo, che fi Sarà dichiarato qualisiano le quattro principali guardie, & perche chiamate prima, seconda, terza e quarta & la deriuatione de nomi tali, il che fatto, si trattarà della diuisione della spada epoi delle contra posture, & delle misure, & di alcune altre cose gindicate da noi necessarie, & utili al buono osseruatore[7] di quest’ arte."
"[2] Description of the four principal guards and the origin of their names. The four guards arise from the four faces of the hand and the sword, that is to say of the two edges and the two surfaces; and these produce four different positions. Prime is that position which the hand takes in drawing the sword from the scabbard, when the point is turned towards the adversary - all the guards especially with the sword alone must be formed with the point so directed. When the hand is turned slightly upward we have seconde, and tierce when the hand is in its natural position turned neither up nor down. When the inside of the hand is turned upwards we have quarte. The hand in turning can take these four positions only, and being in prime cannot go to quarte without passing through seconde and tierce; so the name quarte is given to the last position. Prime is the most suitable position for grasping the sword, although it can be done in seconde or tierce: but with the hand in quarte the sword cannot be drawn from the scabbard. You must know that nothing can be done which does not arise from one of these four positions approximately; we say approximately, because, if you consider, you will find that there is a great distance between one guard and another owing to the width of the surface of the sword and of the hand, so that between prime and seconde there is a mean, where the hand might stop, and similarly between seconde and tierce, and between tierce and quarte. Therefore one might say that there were four legitimate guards and three bastard, since each bastard resembles the two, between which it is formed. But to avoid the confusion of so many terms we shall speak only of the four legitimate guards, which will serve very well for the three bastards also; for the quality of the guard is considered not only from the position of the hand, but also from the direction of the point, wherein lies the force of the guard. Therefore we shall divide the guards into these four only, especially as with the sword there are only four methods of hitting, that is on the inside, on the outside, below and above. The great differences between one guard and another will be explained when we treat of their natures, when we shall consider the various methods of defence, and the changes made in hitting, according to whether they are formed with the sword extended or withdrawn, high or low; we shall then treat of the nature of each one separately.","DICHIARATIONE DELLE QVATTRO Guardie principali, & donde deriuino linomi di esse. Cap. 2. NASCONO LE QVATTRO GUARDIE DA QVATRO PROSPETTIVE, CHE HANno la mano, & la spada, ciò è dui fili, & dui piatti, che però fanno quattro effetti differenti, la prima si dimanda quelsito, doue uà la mano nel cauare la spada del fodero quando si uolge la puntauerso il nimico (perche intendiamo che tutte le [2] guardie massime nella spada sola si debbano cosi formare, & quando la mano si uolta un poco ingiù quella è detta seconda, la terza poi quando la mano sta naturalmente senza uoltarla ne nell’ una, ne nell’ altra parte, & la quarta quando si uolge essa mano dalla parte di dentro, laquale mano non può fare se non quelli quattro effetti nel uoltarla, & hauendola nella prima non può andare nella quarta senza passare per la seconda, & per la terza, che per essere l’ultimo effetto aquista nome di quarta. La prima è la più comoda per mettere mano alla spada, ancorche si possa fare, con la seconda, è con laterza, se ben non cosi facilmente, mà con la mano in quarta non si può già cauare la spada del fodero, & deesi sapere che niente si può fare, ilquale non proceda dalla natura di una di queste quattro noi diciamo natura, perche chi ben considera troua gran distanza trà l’una, & l’altra guardia, & questo per la larghezza del piatto della spada, & della mano, talmente che trà la prima, & la seconda uiè un meggio, douesi potrebbe fermare la mano, & così trà la seconda, & la terza, & trà la stessa terza, & la quarta, che perciò si potrebbe dire, che ui fossero quattro, guardie legitime, & tre’ bastarde, perche ciascuna bastarda tiene delle due, trà quali è formata, mà noi per non mettere confusione con tanti termini parlaremo solamente delle quattro legitime, lequali benissimo seruirãno anco per quelle tré bastarde, perche laqualità della guardia si considera non solo dal sito della mano, mà ancora dall’ effetto della punta, laquale dà la cognitione della forza di essa guardia, però ci deuiamo risoluere in queste quattro sole, & tanto più, quanto, che nella spada non cisono altre, che quattro maniere di ferire cioè didentro, di fuori di sotto, & di sopra, eui gran differenza similmente trà l’una, & l’altra guardia, come si mostrarà quando si trattarà della natura di esse, oue si uedranno di uerse diffese, & mutationi di ferire, secondo faranno formate longhe, ò ritirate, alte, o’ basse, & iui si trattarà della natura di tutte quante separatamente l’una dall’ altra."
"[3] The divisions of the sword: the faible and the forte. The blade of the sword is divided into four parts; the first is the part nearest the hand, the second quarter extends to the middle of the blade, the other two extend to the point. The first part near the hand is the strongest for parrying, and there is no thrust or cut, delivered by the strongest arm, which, if parried in this part, the sword cannot defend and resist without disorder, if the rule and the time is observed, as will be explained. The second part is somewhat weaker, but still it will defend well enough, if you parry where your adversary's sword has less strength. The third part is not good, especially against cuts, unless strengthened with the adversary's body at the moment of parrying; this will be explained in considering the defence. The fourth part is entirely bad and must not be thought of in the defence, although in the attack it is the strongest and most deadly. It is also true that a cut made with half the third part and half the fourth is a strong attacking stroke, whereas a cut made with the third part only would not be one half so effective as a cut made with the fourth part as well. The first and second parts then are only to be used in the defence, and the third and fourth in the attack; so that the sword is divided, one half into the defensive part, and the other the offensive.","DIVISIONE DELLA SPADA Per conoscere il debile, & il forte di essa. Cap. 3. LA LAMA DELLA SPADA SI DIVIDE IN QVATtro parti, la prima è quella che pende più uicina allà mano, la feconda è quello altro quarto, che ariua sino à meggia lama, l’altre sono l’ultima metà spartita anch’essa in due, laquale uà sino alla punta. La prima parte appresso la mano è la più forte per parare, ne ci è botta di punta, ò di taglio tirata da ogni galiardo braccio parata in quella parte, che la spada non diffenda, e resista senza disordine, osseruandosi però la regola, & il tempo, come si dira’ la seconda parte è alquanto più debile, non dimeno anch’essa diffende assai, quando si sà andare à parare oue la nimica spada hà minor forza. La terza parte non è buona massime contra taglii, ne si può contra essi adoprarla, se non fortìfficandola col corpo nimico nel tempo; che si para, come pure s’intenderà oue si parlarà delle diffese. La quarta parte è intieramente cattiua, ne bisogna fare pensiero d’ hauerla quanto alla diffesa, sé ben nella offesa è la più ualida, & quella che più mortalmente ferisce, si come anco è uero quando un taglio fà la ferita meggia con la terza parte & meggia con la quarta, che fà anco all’ hor grand’ offesa, & che se fosse [3] della terza sola non farebbe la metà di quello, che fà con la quarta, la seconda & la prima parte dunque non s’hanno da oprare se non per diffesa, & la terza, & quarta peroffesa, in modo tale, che essa spada uiene ad essere compartita meggia in diffendere, & meggia in offendere."
"[4] Method of forming the counter-positions, showing The position of the arms and the body, and when they are to be formed. If you wish to form a sound counter-position, the position of the body and arms must be such that without touching the adversary's sword you are defended in the straight line from the point of his sword to your body, so that without making any movement of the body or the sword you are sure that your adversary cannot hit you in that line, but that if he wishes to attack he must move his sword elsewhere, with the result that his time is so long, that there is every opportunity to parry. But in forming this position care must be taken that your sword is held in such a way as to be stronger than your adversary's, so that it may offer resistance in defence. This rule can be observed against all positions and changes of your adversary, whether accompanied by the dagger or any other defensive weapon, or when you use the sword alone. He who can most subtly maintain this guard will have a great advantage over his adversary. But it often happens that when you form this guard, your adversary forms another against it. Often also this guard is formed so far out of distance that your adversary can wait until you begin to move your foot against him, and at the moment of year advance change his line, so that you are disconcerted by another counter-position. Therefore you must be full of devices and be able in a moment to take up another position of advantage against that of your adversary and make a fresh guard, unless you are so far within distance that you can hit him daring this change, and if in changing he has not retired, since if he had retired you could not hit him even if you had been within distance. You must then take up another counter-position and approach at the same time, to regain the same distance as before. In forming this counter-position you must bear in mind the rule, that the body must be so far distant that the adversary cannot hit, or, if you have approached within distance so that he could hit by advancing his foot, you must form the counter-position without moving the feet. In this way, if the adversary should attempt to hit during the movement, you could parry and hit him, or break ground;[8] in the latter case his sword, would not reach. But if in moving your weapons to take up this advantage, you have moved slowly, you could then abandon your object and hit at the very moment in which your adversary advanced to attack, parrying at the same time. So that if the first movement is made without violence, you can abandon your attempt and make another, as opportunity offers. In short, if you wish to get within distance with some safety, you must first form the counter-position, and if disconcerted by your adversary's counter-position, it will be better to break ground than to approach, until there is an opportunity to get an advantage.","MODO DI FORMARELE CONTRAPOSTVRE Per intendere come l’armi si denno situare & il corpo, & quando si hà da cominciare à formarle. Cap. 4. VOLENDOSI FORMARE LA CONTRA POSTURA che stia bene fà di mestieri situare il corpo, & l’armè in modo, che senza toccare la nimica spada si sia diffeso dalla retta linea, che uiene dalla punta auersa al corpo, si che senza fare moto alcuno ne di corpo, ne di spacia si sia sicuro, che il nimico non possa ferire in quella parte, mà uolendo offendere sia neccessitato portare la spada altroue, & cosi il suo tempo uenga ad’ essere tanto longo, che dia gran comodita di parare, mà nell’ acconciarsi in cotal modo si richiede[9] si tuare la spada in guisa, che sia più forte della nimica acciò possa resistere nella diffesa, & laquale regola si può offeruare contra tutte le posture, & mutationi nimiche, tanto essendo accompagnata dal pugnale, onero da altra sorte di arma diffensiua, quanto con la sola spada, & collui, che saprà più sotilmente mantenersi in detta contraguardia haurà gran uantaggio soprà l’nimico, mà spesse uolte auiene che nel formarla esso nimico ne forma un’ altra contra quella & spesse uolte anco si uà à fare detta contrapostura lontano dalla misura tanto, che il nimico può aspettare che si comincia à mouere il piede contra di lui, & nel medesimo tempo, che si li auicina mutare effetto, & serrare di fuori l’offeruatore di questa regola con un’ altra contrapostura, Pertanto è neccessario l’essere ricco di partiti & sapere nell’ istesso punto trottare un’ altro sito uantaggioso à quello dell’ auerssario, & farli noua contraguardia, quando non si fosse tanto in misura, che si potesse ferirlo nella sua mutatione, ouero se esso nimico mutandosi non si fosse ritirato, perche in tal caso se bene si fosse stato nella misura non si; harebbe potuto ferirlo, mà si bene farli un’ altra contrapostura auicinandosi nel medesimo tempo per riguadagnare la stessa distanza di prima; & è di mestieri formando la contrapostura, di usare una certa raggione, ciò è che nelo situare il corpo si sia tanto lontano che il nimico, non possa ferire, ouero, essendosi gionto in distanza tale, cho detto nimico possa con l’auanzare il piede ferire, formarla senza moto de’ piedi, perche cosi facendo, ancor che esso nimico uolesse in quello mouimento ferire, potrebbesi parare, & ferire lui, ouero rompere di misura, che in quest’ alrro modo la nimica non arìuarebbe, mà se nel mouere l’armi per pigliare detto uantaggio, il moto fosse stato fatto lentamente, si potrebbe allhora lasciare l’in cominciato, & ferire in quello tempo proprio, che il nimico si fosse auanzato per offendere, parando insieme, si che se si farà il primo moto senza uiolenza si potrà lasciare l’ lincominciato, & farne un’ altro secondo l’ ocasione, dunque chi si uorà auicinare con qualche sicurtà nelle misure sarà neccessario formare prima la contra postura, & quello che si trouarà serato fuora dalla contrapostura nimica, haurà più raggione di stare in rompere di misura, che auicinarsi sino che li uenga comodità di pigliare il uantaggio."
