"[26] How to make this extension in seconde by advancing the left foot in order to make a long extension. This extension is made with the guard in seconde, with the left foot brought forward in the time of the adversary's movement. Here you may clearly perceive how low a body may go and pass right to the adversary's body with swiftness, when you know how to control the body. This figure is drawn from life like all the others. With this manner of advancing the foot the lunge is very long. The body is protected by its low position. The left foot is carried forward, as is seen, but the right shoulder and side also go forward in such a manner that the lunge is as long as possible. The occasion for its use may arise, not only when the adversary tries to lunge or pass, but at the slightest time offered, when you are within such distance, that at the first movement you can pass the adversary's point. You may take the time to make such a lunge whether on the outside or the inside, for the body is so low that your adversary's sword remains far out of line, and all the more when his point has been no lower than your chest. Further this extension is made with great velocity, much more so than the first extension.","[34] COME LEFFETTO DI SECONDA PASSATO di piede manco sià da fare per orinare lontano come per la seguente. MA QVESTO EFFETTO, CHE SEGVE E FATTO CON LA SEconda guardia passata col piè sinistro inanzi, in tempo del moto della nimica, & di quì si può chiaramente conoscere quanto un corpo possa andare à basso, & passare sino al corpo nimico con prestezza quando si sappia numerare bene; questa figura è tratta dal uiuo come tutte l’ altre, & con questa forma di passare, che in essa si uede, la botta si slonga molto, & oltre lo abbassarsi, ilche salua il corpo, portando il pie manco inanzi come si uede, la spalla nondimeno, & il fianco destro uanno sempre inanzi, in modo che la botta uiene à farsi longhissima, & l’ occasione del quale operare può nascere, non solamente, quando il nimico uuole ferire à piè fermo, ò passare, mà ancora in ogni picciolo tempo, quando l’ huomo si troua in misura, tanto che còl primo moto può passare la nimica punta, & si può pigliare il tempo di operare cotale botta tanto essendo di fuori, come di dentro, perche il corpo si abbassa tanto, che la nimica resta molto lontana dalla presenza, & tanto più quando la punta de’ detta nimica non sia stata più bassa del petto; & in oltre questa forma di pass uà con uelocità grande, & molto più ueloce il secondo, che il primo passo. 8."
"[27] This plate illustrates the guard in tierce, which arises from the guard in prime, as does the guard in quarte, as will be seen. The guard in tierce is less fatiguing than the other two, because the arm is in a natural position. But the hand is too low and the point inclined upwards at an angle, so that there are many exposed parts. If you draw a straight line from the point to the body you will see how great is the angle, and all the space between that straight line and the hand is exposed, where you may be hit on the outside and on the inside. On some sides it is not strong; further you may be hit before your hilt is reached. If you wish to defend the upper parts you make so large a movement with the hand, that you cannot reach the defence in time, and your adversary can easily deceive you. Again, as your sword is at such an angle, in parrying you often go out of line, offering a great advantage to your adversary. Again, by bringing the sword into the straight line you weaken it, for the sword is always weakened by being extended, with great danger that your adversary's sword, if already extended, will remain the stronger, since the sword is always stronger after coming to rest than in its passage. Further, one who stands in this manner with his sword at an angle, can make little use of the disengagement, since his point has to make too great a circle and too large a movement. Nevertheless this guard may be used, because its nature is not always known. Though the sword is at a great angle and the body much uncovered, still you can sufficiently deceive your adversary by avoiding and freeing your sword by a half disengagement. Therefore he who can use these devices in time will defend and easily protect himself. The desire of the adversary to hit is increased by the sight of so much exposure, with the result that you may readily save yourself and hit your adversary. But we shall form a safer guard in tierce.","[35] QVESTA FIGVRA, GHE SEGVE DI MOSTRA LA TERZA GVARdia, laquale nasce dalla prima, come anco la quarta secondo, che si uedrà; Questa terza è diminore fatica delle altre due, perche il braccio stà naturale, se bene la mano troppo bassa, & anco la punta molto angolata allo insù, & perciò con molti scoperti, in modo che se si tirasse una linea retta dalla punta al corpo si uedria quanto fosse grande l’ angolo, & tutto quel uacuo, che resta frà la detta linea retta, & la mano, è scoperto, oue si può ferire per di fuori, & per di dentro, & in alcuno di questi lati non hà foraa, oltre il potere essere ferito prima, che si gionga al suo finimento, doue che uolendo diffendersi le parti alte uiene à fare cosi gran moto con la mano, che non può giongere in tempo alla diffesa, & il nimico lo può facilmente ingannare, oltre che stando l’ huomo tanto angolato, nel parare uà spesse uolte fuori di presenza con dare gran comodità al nimico, & similmente dirizando la spada in retta linea uiene à debilittarla, perche nel stenderla si debilitta sempre con molto pericolo, che quella, laquaìe già è distesa non resti più forte, perche più forte è sempre la spada doppo che è fermata, che nelo andare; oltre diciò collui, che stà in questo modo angolato poco si può ualere delle cauationi hauendo la punta da fare troppo gran giro, & gran moto nondimeno si può anco adoprare questa forma, perche non ogni huomo conosce la sua natura, che se bene forma un’ angolo grande, per ilquale il corpo è così scoperto, con tutto ciò puo assai ingannare sfuggendo di uita, & di spada è meggie cauationi, talche chi saprà seruirsi di queste in tempo si diffenderà, & saluerà ageuolmente, perche uedendo un corpo così scoperto ere le e il desiderio al nimicò di ferirlo, il che caggiona, che questo tale facilmente si salui, & ferisca il detto nimico, mà si formarà una terza assai più sicura. 9."
"[28] This plate shows the manner of forming a sword guard in tierce. The position of the arm and sword requires exactness for the hand should not be turned at all. Where the natural guard in tierce is weaker, this guard, also in tierce, is stronger. By the change of position the posture of the body has been changed to great advantage and improvement, since the angle of the side is well drawn back. The outside is defended and there is little uncovered on the inside. This is the true method of trying to engage the adversary's sword whether on the inside or the outside, for there is little or no movement to be made with the arm, but with the point of the sword only, which will so subject the adversary's sword as to keep it always underneath; your hand will then be between seconde and quarte in such a way, that you can engage with little movement in the one or the other line according to opportunity. Therefore we consider it to be one of the best guards.","[36] NELLA SEGVENTE FIGVRA SI VEDE IL MODO DI FORMARE bene la terza guardia, il sito delquale braccio, & della quale spada si addimanda giustezza, perciòche la mano non è in parte alcuna uoltata, & doue la terza naturale più debile, questa, ancora, che una terza sia, è più sorte, & dalla sua mutatione, & suo sito ha mutato natura, & forma di corpo con assai uantaggio, & miglioramento per l’ angolo del fianco, che è molto lontano; Di fuori è diffesa, & di dentro hà poco scoperto, & questa è la uera maniera di andare à trouare la spada al nimico, sia di dentro, ò di fuori, perche si hà da fare pocò, ò niente di moto col braccio, mà con la sola punta della spada, laquale superarà di tanto la nimica, che la tenerà sempre disotto, la cui mano uiene ad’ essere situata trà la seconda, & la quarta in modo che con pochissimo moto si può trouare nell’ uno, ò nell’ altro sito secondo l’oportunità, che perciò noi la teniamo per una delle migliori. 10."
"[29] We have wished to include this guard in tierce, since it has some advantageous principles, as we shall explain. It may be derived from the extended tierce if in that tierce the sword is in danger of being engaged, or for any other reason. You will free yourself by disengaging from that tierce to this, for the inclination of the body is now backwards, as may be seen; without moving the feet, but by merely bending the body and the knees the body is carried so far back, that the adversary cannot hit. At the same time the sword is freed. If your adversary attempts to engage it or to hit by carrying himself forward, with this guard you may very well hit him simply by again advancing your body forward at the same moment as he advances. Further it is a sufficiently good guard to practice, because it forms an oblique line towards the ground in such a manner, that your adversary cannot easily seize it. If he tries to engage your sword so low down without using the same advantageous position of the body, he will certainly be hit, since the distances are very deceptive. When within distance you appear to be far out of distance, and when the part which is bent backwards is bent forwards, without moving the feet, you extend more than half a sword's length by the mere inclination of the body, so that you reach further than your adversary estimates, if he has not understood the nature of the position. Thus as this guard may serve for this long reach, it may also serve for a withdrawal, since the distance is enlarged more than half a sword's length, with the result that your adversary cannot reach in time, and you have the advantage in defence and attack. But you cannot engage his sword before coming within close distance, unless you are careful to bring your feet together and bend the body as far forward as possible; then indeed you may reach his point though within wide distance. With this guard you should remember that the exposed part above is so far back that it cannot be hit if you know how to keep your sword free. Thus this position is very much to the purpose and good against various guards at an angle, and even extended guards. A body in such a position could easily and swiftly get out of line of the adversary's point, and with equal celerity pass on the one side or the other, except against the guard in prime, which could engage your sword down to the ground.","[37] HABBIAMO IN QVESTO LVOGO VOLVTO METTERE QVESTA terza per hauere in se alcune raggioni uantaggiose, come s’ intenderà, laquale può deriuare dalla terza distesa in caso che essa terza distesa si trouasse in pericolo per esserli occupata la spada, ò per altra caggione, doue che l’huomo di liberaria col partirsi da quella, & calare in questa, perche tutto il pendicolare del corpo, che era prima in quella pendicola indietro, come si uede, & senza mouere li piedi, mà col solo piegare del corpo, & de’ ginochii uiene à portarsi tanto lontano, che l’ nimico non lo può ferire, liberando anco nel medesimo tempo la spada, che se l’ auerssario la uuole aqiustare, ò ferire portandosi inanzi l’ osseruattore di questa guardia può ferire lui benissimo col solo ritornare del corpo inanzi nel punto medesimo che l’ detto auerssario uiene, oltre diciò è una guardia assai buona da essercittare perche tiene la linea obliqua uerso terra in modo che l’ nimico non la può hauere tanto facilmente, chi la uolesse ritrouare così bassa senza operare l’ istesso uantaggio del corpo, restarebbe sicuramente ferito atteso che le distanze sono così falaci, perche gionto, che sia l’ huomo in misura li pare anco di essere molto lontano, & quando quella parte, che è piagata indietro si piega alò inanzi, senza anco mouere li piedi si allonga assai più di meggia spada col solo pendicolare del corpo si che ariua più di quello che l’ nimico può hauere giudicato, quando non habbia cognosciuto la natura del sito, & così come può seruire per ariuare altretanto può fare per dillongarsi perche la misura uiene à slargarsi più di meggia spada, ilche caggiona, che l’ nimico non può ariuare in tempo, & questi piglia la comodità della diffesa, & offesa, alquale non si può trouare la spada, che prima non si sia gionto nella misura stretta, se non si hà una diligente cura di metrersi in poco passo, & piegare il corpo inanzi più che sia possibile, che all’ hora purpure si potria ariuare alla sua punta standosi nella misura larga, & deuesi anco auertire [38] che quello scoperto di sopra è tanto lontano che non può essere ferito se il detto osseruattore della guardia saprà conseruarsi la spada libera; & così questa forma di sito uiene ad’ essere molto à proposito, & buona contra diuerse guardie angolate, & anco distese, perche un corpo in tale forma situato uscisse con facilità, & prestezza dalla presenza della punta nimica, & anco con la medesima celerità passa per l’ una, & per l’ altra parte, eccetto contra la prima, laquale l’ andarebbe à trouare sino in terra. 11."
"[30] This plate illustrates an extension in tierce, which shows how to advance the foot, bend the knee and incline the body sideways, so that there is little exposed. It also teaches how to stretch the wrist in order to lengthen the line and reach further in a lunge, and to recover after making the thrust. If you wish to recover quickly, you must not straighten the body, but bend the knee of the leg to the rear, bringing the weight of the body on to it low down, so that the forward leg is straightened and relieved of the weight in such a way, that you can easily and conveniently raise it. You perceive that all these things must be done in one time, and that if you do not know how to shift the weight of the body you cannot readily raise the foot, especially when the feet are far apart and the body much bent, except with great inconvenience, difficulty and length of time.","L’ EFFETTO, CHE SI VEDE IN QVESTA FIGVRA, CHE SEGVE è una distesa di terza, ilquale di mostra come si deue auanzare, il piede, & piegare il ginochio pendicolare il corpo in filo, acciò che si faccia poco scoperto, & non meno insegna come s’ habbia da stendere la chiaue della mano per più allongare la linea, & ariuare più lontano ferendo à piè fermo, & rihauersi subbito data la botta, che uolendo essere pronto à ricuperarsi non si deua dirizzare il corpo mà si bene piegare il ginochio della gamba didietro portandoli sopra il peso di esso corpo così basso, che uenga à dirizzare quello dinanzi, & soleuarlo dal peso in modo che facilmente & con comodità si possi leuare, lequali cose tutte, si uede, che si hanno da fare in uno tempo medesimo, & che non sapendosi contrapesare bene il corpo non si può neanco leuare bene il piede, massime stando il passo tanto disteso, & il corpo così piegato se non con gran scomodità, & difficoltà, & anco longhezza di tempo. 12."
"[31] This is a guard in quarte, the last of the four guards. It is formed simply with the arm at an angle, for which reason you are strengthened, and sufficiently covered on the inside. But you cannot disengage with much promptness, and on the outside are much exposed because of the angle formed by the arm and the hand. Although your position is strong, still if the adversary attempts to hit, it would not be so good to parry or to attempt to hit under the sword on the right side of the guard, letting his point pass without parrying. In this manner you would be most successful; for your arm being at such am[!] angle, if your adversary wishes to reach the body, his point must pass inside that arm. If the arm is extended towards the inside, it will cover all the part, which was seen exposed before, and will hit without touching the adversary's sword. With this guard, if you have an opportunity to change from quarte to seconde, the result will be effective, and still more so if the arm is fully extended from its present angle. The hand will be so far on the inside, that the adversary's sword cannot cover much in that line. When you change to seconde, an angle opposite to the first will be formed, so that your adversary cannot be in as strong a position. It will be all the better if in changing you continue on to the body. For if you measure the path taken by your point in hitting and the path taken by the adversary's point in defending, you will find that the path of the defending point is the greater. Although your hand has moved from one angle to another, a large movement, still the point will have gone to the body without shifting. Thus that large movement will have done damage to the adversary and not to yourself, if you have changed the front of your body by moving it out of the line of his point.","[39] QVESTA CHE VIENE SARA LA QVARTA, ET VLTIMA DELLE quattro guardie formate semplicemente col braccio così angolata, per laquale raggione l’ huomo uiene ad’ essere forte, & à tenersi assai coperto di dentro, mà non può cauare con molta prestezza, & dalla parte di fuori fà gran discoperto per l’ angolo, che dal braccio, & dalla mano si forma, & seben quiui è più forte, niente dimeno se l’ nimico andasse à ferire nõ sarebbe si buono l’ andare à parare quãto l’ andare à ferire di sotto la nimica nel destro fianco della medema guardia, lasciando passare la pũta di detta nimica senza parare, che in questo modo benissimo riuscirebbe, perche stãdo il braccio in quella guisa angolato, è forza à chi uuole giongere al corpo, che la sua punta passi di dentro al detto braccio, ilquale, se si stenderà uerso la parte di dẽtro uerà à nascondere tutto quello scoperto, che già si uedeua, & ferirà senza toccare la nimica, & quãdo l’ osseruattore di detta guardia haurà occasione di uoltare di quarta in seconda farà grand’ effetto, mà più grande ancora, se il braccio sarà del tutto disteso per l’ angolo che la forma, stando nel sito oue si troua, & con la mano tanto in dentro, che caggioni alla nimica di non si potere coprire molto in quella parte, & quando si uoltarà poi in seconda uerà à fare un’ altro angolo contrario al primo, doue essa nimica non potrà hauere tanta forza, & tanto meglio uerà fatto questo, se nel uoltare sarà andato al corpo, perche chi misurasse la strada fatta dalla punta in andare à ferire, & quella fatta dall’ altra in andare alla diffesa, trouaria essere maggiore quella della diffesa, che dell’ offesa, che con tutto che la mano fosse andata di un’ angolo nell’ altro, che hauria caggionato gran moto, nondimeno la punta sarebbe andata al corpo senza mouersi dal punto, & così quel gran mouimento hauria fatto danno al nimico, & non à lui, quando hauesse mutata la prospettiua del corpo col partirsi dalla presenza della punta nimica. 13."
"[32] The plate represents an extended guard in quarte. It is much better than the preceeding[!] one, and beyond comparison more cautious than all the others, because it keeps the adversary at a distance. He cannot be sure of engaging your sword, because with this guard you can disengage easily and subtly and with greater promptness than with the other on one side or the other. Its greatest strength is on the outside, where you cannot be hit, and the inside is assured by the effect of the hand being turned in that direction in such a way, that no path is left for the adversary to take, except by pushing your sword out of the line, a dangerous plan, as with this guard the disengage and double disengage are swift. His only resource is to try to disorder your sword by a feint or a movement, in order to hit below, carrying his body suddenly forward; for he could not reach with a lunge without putting himself in greater danger of an attack. Thus this is the most secure of the four extended guards, as we have said. There is no other which can be maintained with greater ease, with the sword more ready and free.","[40] MA QVESTA RAPRESENTATA DALLA SEGVENTE FIGVRA sarà la quarta delle guardie distese molto migliore della antecedente, & più cauta senza comparatione di tutte l’ altre, perche tiene il nimico lontano da se, ilquale non può assicurarsi di trouare la spada, perche con essa guardia si caua molto facilmente, & sottilmente, & con maggiore prestezza dell’ altra tanto per una parte, come per l’altra; Hà la sua maggiore forza di fuori, oue non può essere ferita, & di dentro è assicurata dall’ effetto della mano uoltato in quella parte, in modo che non lascia all’ auerssario alcuna uia di ferire, se non col spingere la sua spada fuori di linea, effetto pericoloso, per essere detta guardia così pronta à cauare, & ricauare, restarebbe solo al detto auerssario di potere disordinarla con qualche finta, ò mouimento, affine di ferirla di sotto con portare uia il corpo subbito, perche à piè fermo non giongerebbe, che non fosse lui in maggiore pericolo di essere offeso, si che questa è la più sicura delle quattro distese, come si è detto, ne altra uiè, che con maggiore facilità possi tenere più pronta, & più libera la spada. 14."
"[33] This is also a guard in quarte and very different from the two last. As you may see in the plate, the chest is exposed to the adversary and the feet in an oblique line. The intention is to move to either side according to the opportunity. The adversary cannot proceed to hit either your chest or head, for your feet are on either side of his sword, so that by lifting one of them your body will be out of line, so that you can hit in quarte, in tierce or in seconde, as the time and the occasion demand. With this guard you are uncovered on the outside. You invite your adversary to attempt a hit there, knowing that it is the strongest part, and that the angle is naturally of such a kind, that if he tries to hit in that place, by carrying the left foot in a straight line, extending the arm and leaving the hand in the same position, you will hit your adversary below on the right, or above by making the angle still larger and carrying the hand as high as the shoulder. In this way your lunge will be so strong that, however much your adversary tries to parry, he will still be hit. If he approaches too close without resolution, you should turn your hand from quarte to seconde, covering the head and carrying the left foot forward, and pass on with body and sword you will make a hit in the chest in seconde. With this guard you must take care to be so far advanced that as you change to seconde the head may penetrate the adversary's point with the bending of the body, and you may then proceed to hit and carry your left hand to his hilt, if the adversary disengaged in order to hit in the lower lines, he would effect nothing, because your sword, which would have already begun to change into that line, would prevent him, and would hit on the outside, for you would have brought both sides of your body equally forward; this excellent result would be due to the length of your reach and the strength of your sword. In this way the only difference would be that your body would pass on the outside instead of the inside. With this guard you may easily use the left hand.","[41] LA SEGVENTE, CHE E VNA QVARTA ANCOR LEI E MOLTO differente dalle due passate, perche, come nella sua figura si uede essa scuopre il petto al nimico, & stà col passo obliquo con disegno di portarsi ò nell’ una, ò nell’ altra parte secondo l’ opurtunità, ne si può andare à ferire quel petto, ne quella testa, che le sue gambe non siino l’ una dall’ un lato, & l’ altra dall’ altro della spada di quello, che uuole ferire, in modo che leuandone una remane il suo corpo sempre fuori della presenza, si che può ferire, & di detta quarta, & di terza, & di seconda, si come che richiede il tempo, & l’ occasione: Questa guardia è scoperta di fuori, & uà cercando, che l’ nimico uada iui à ferirla, sàpendo quella essere la più forte parte, & che naturalmente fà angolo in modo, che detto nimico l’ anderà pure in quel luogo à ferire, essa col portare il sinistro piede in retta linea, stendendo il braccio, & lasciando la mano nelo stesso luogo ferirà di sotto nel fianco destro del nimico, ouero di sopra con fare l’ angolo anco più grande & portando la mano alta, come la medema spalla, che in questa guisa haurà tanta forza che quanto più uorà il detto nimico parare tanto più rimanerà ferito, & quando il medesimo nimico troppo s’ auicinasse senza risolutione, quella uoltarebbe la mano di quarta in seconda, coprendosi il capo, con portare inanzi il sinistro piede, & passare dentro col corpo & con la spada, che ferirebbe nel petto con la detta seconda, mà deue auertire, chi usa questa guardia di essere tanto inanzi, che nel uoltare in seconda la testa possi penetrare la punta nimica con lo piegare del corpo, & poi andare à colpire con penetrare la sinistra sino al finimento, che se bene il nimico cauasse perferire disotto non farebbe cosa buona per rispetto della spada uoltata, perche la spada, che già hà cominciato à uoltarsi per fare la cauatione in quella parte lo impedirebbe, & ferirebbe di fuori per ritrouarsi già col corpo uoltato inanzi tanto con un fianco, quanto con l’ altro, buona caggione, della lontananza dello scoperto, [42] & della forza della spada, & in questo modo non ui sarebbe altra mutatione, se non che l’ corpo quale dourebbe andare di dentro andarebbe di fuori; & in questa guardia si può facilmente usare la sinistra mano. 15."
